address,date,price,rating,restaurant,text
"56 NW 29th St, Miami, FL 33127",10/30/2016,$$,5,della bowls,"Few people could be more carnivorous than me. I love meat and I rarely have a meal without an animal in it. I'm also a foodie so just because I enjoy meat does not mean I don't enjoy plants too. I love fruits, veggies, and other non-animal organics. I ate here because my daughter's on a health kick and I figured why not. I can say that if I HAD to be a vegetarian, Della's would be my number one choice!! I had the brown rice, chick peas w sea salt, crispy broccoli w olive oil & garlic, yellow cashew curry, and avocado and loved everything about it. Totally vegan and very filling (took a good portion home). Would definitely eat there again!"
"56 NW 29th St, Miami, FL 33127",5/6/2018,$$,5,della bowls,One of my favorite vegan restaurants. Best vegan bowls in the city. The cauliflower & mushroom additions made to the menu are . Definitely must check this place out if you want to try vegan food in Miami.
"56 NW 29th St, Miami, FL 33127",9/19/2017,$$,5,della bowls,"This is the i-can't-believe-it's-vegan staple. The bowls here are beyond delicious (I actually crave them daily) and the ambiance is absolutely amazing! It's chill and earthy and organic. Plus everyone that works here is amazing! ,Recommendation: Definitely try their Caribbean Bowl! It's impossible not to love it. If you want a smoothie, they have an almond butter banana one that hits the spot multiple times. ,This is a must try spot in Miami. A place I'd call home. If you haven't been yet... are you really even living?!"
"56 NW 29th St, Miami, FL 33127",11/16/2017,$$,5,della bowls,"Wow! That's the best way to describe this delicious vegan food! So tasty and healthy! I regret not ordering the larger bowl but was just enough to fulfill me. I had the Dale Bowl, so yummy!  I definitely recommend this to all my vegan friends  They also have UBEREATS to deliver! Will order again! Thanks guys!"
"56 NW 29th St, Miami, FL 33127",1/24/2017,$$,5,della bowls,"Oh, it's all vegan? Yes it is, folks, and let me tell you: I didn't miss meat at all while eating from Della Test Kitchen. ,Their menu consists of bowls that already have the ingredients chosen for you. A friend of mine told me she usually opts for the green bowl that has avocado, broccoli and other types of green veg. I decided to make my own custom bowl with a base of black coconut rice, tempeh protein, sweet potato, yellow curry cashew sauce and toasted almonds. WOW! It was so delicious. I don't think I've ever felt so GOOD and FULL after eating a vegan dish. The portion size was fantastic; I could have saved some for later, but I had a friend help me eat it. Every component of the dish was cooked and spiced to perfection. ,Next time I'm in the Wynwood Yard, I will glady become vegan for a meal without any regrets."
"56 NW 29th St, Miami, FL 33127",4/13/2018,$$,5,della bowls,"When I'm in Wynwood this is where I go for my vegan lunch. Really good, fairly fast service and a fun environment. It's outdoors so you can bring your fur kids :)"
"56 NW 29th St, Miami, FL 33127",5/11/2016,$$,5,della bowls,"Yes yes yes! I was having lunch with a dairy-free friend and knew that Della Test Kitchen would be a good place for us to hit up since it's vegan. ,You can create your own bowl or opt for one of the existing combinations. Since I was a first timer, I decided to go with the Southwest bowl of greens, quinoa, tofu, sweet potatoes, tomato, sunflower seeds, avocado and red sauce. I also grabbed some of the hot pepper sauce on the counter to douse on top. It was spicy but went perfectly with this dish. Overall, my bowl was fresh, filling and flavorful. It was hard to finish it all but I couldn't leave one bite because it was that good! I also stole a bite of my friend's Curry bowl. No matter what you're in the mood for, you can find or make a bowl to suit you.,I can't wait to try more combos and would definitely have lunch here weekly if I could! Bowls are $9.50 with smoothies and other drinks costing between $7-$8. You order at the truck and then sit under the tent to wait for your food. It's an overall chill atmosphere and perfect for when it's nice outside.,There seemed to be some confusion among the staff when it came to food getting delivered, so I'd maybe suggest using a number system instead of the name calling. The girl taking our order also had to answer the phone a few times to worry about deliveries, which held the long line up a bit. The food gets to ya eventually and is worth the wait!"
"56 NW 29th St, Miami, FL 33127",8/18/2017,$$,5,della bowls,"This place serves amazing plant based bowls. The Mediterranean bowl is a party in your mouth. Everything fresh and so tasty and very decent prices. I hope this place stays up permanently. The area is so cool and cute, which makes it perfect for a nice late lunch dinner with friends. Wynwood yard yes for vegan options in Miami!"
"56 NW 29th St, Miami, FL 33127",2/15/2017,$$,5,della bowls,"""Want to try this place? It's vegan"" my friend asked me, knowing full well that I love meat. However, it being a gorgeous night in Wynwood, live music playing in the background, and pretty stringed lights hung about,  I decided ""why not?"" and tried Della's kitchen and what can I say? Vegan tasted really good. It was filling and satisfying. ,Dellas is a create your own bowl place with options of base, vegetables, faux meats, and sauce. There are also options for bowls per Della's creation. I decided to go with the Caribbean bowl. It was a delicious generously portioned bowl of black coconut rice(so good), plantain, kale, avocado, curry sauce, and a faux meat (I can't recall the name of it). It was very filling and flavorful! There is bench seating right in front of the truck as well as a water station. I  thoroughly enjoyed my late night dinner at Dellas in Wynwood yard and I am looking forward to my next vegan meal there. :)"
"56 NW 29th St, Miami, FL 33127",2/20/2018,$$,5,della bowls,"In my dream life Della would be my personal chef.  Every Monday I wake up and swear that I will only eat healthy foods ever again. But by Tuesday I am usually craving only the delicious.  Della Bowls nails the healthy and the delicious.  I consider myself a pretty sophisticated cook, but I wasn't able to decipher what was in my bowl.  It was the most incredible mix of flavors and textures. This food is NOT only for the vegans of the world.  It is different and interesting.  I wish I could remember the name of what I had eaten, but based on what I could see on the menu, you can't go wrong.  All of the bowls are winners.  AND if you haven't been to the Wynwood Yard, run!  It's a great mix of food, drink, Music and coolness.  It's perfectly blended to create the setting for a fantastic Della Bowl."
"56 NW 29th St, Miami, FL 33127",3/18/2017,$$,5,della bowls,"I am absolutely IN LOVE! Have been wanting to try this forever and I'm so embarrassed that I didn't before because it's SO good! Think of a healthy vegan chipotle, the possibilities are endless when it comes to creating your perfect bowl. They even offer black coconut rice, which I have never seen before. And to super size your bowl for just a few extra bucks, you get to choose two of each category and basically have two meals! ,Of course once my friend, Danny, told me about this option, I had to super size it. Best decision ever cause my leftovers were like a golden midnight snack. So light and filling! The sauces are amazing, they drizzle plenty over your creation. I had the tempeh, and at first bite, you get this instant teriyaki type tofu taste. So delicious. And you MUST try their plaintains because they are the best ever! Usually plaintains are super oily from your typical Latin restaurants but not Della's! They're baked into ooey gooey sweetness pieces of perfection. ,This food truck is poppin inside a little area called Wynwood Yard. They're closed on mondays so be sure to come every other day as it's worth it! I was so pleased with every little thing in my bowl, I will come back over and over to try the entire menu! By the way, they only give you one slice of avocado so think about that before you ask for it lol"
"56 NW 29th St, Miami, FL 33127",7/7/2018,$$,5,della bowls,"My wife and I happened upon della bowls at Wynwood Yard on our first night in Miami. It was recommended to us by the woman from the store right next to it and she did not steer us wrong. Absolutely the best vegan food we had on our trip! We had the dalé bowl (at the cashiers recommendation) and BYO with black coconut rice, adashah, kale, sweet potatoes, avocado and gold sauce. They were both insanely delicious! Both sauces were incredible and the adashah is so creative and versatile! Della makes food the way I cook at home, only better. My wife and I loved it...so so great!"
"56 NW 29th St, Miami, FL 33127",2/10/2017,$$,5,della bowls,"The idea behind most of Della Test Kitchen's offerings is simple: vegan proteins, veggies, and a sauce on a base of rice, quinoa, or greens in a bowl. The execution, however, is delicious. I've recommended it to people visiting Wynwood and have taken people there when I am in the area. The food is consistent and never disappoints. ,You can create your own bowl or select one of their recommended combinations. I've tried about 4 at this point, and they've all been good. There are multiple flavor profiles available, so there is bound to be something to suit your tastes. ,They also have some other things on the menu, like juices. I have had one of the juices and it was tasty.,The actual kitchen is a trailer in Wynwood yard. There is metered street parking right out front. The setting is quiet, and there are several picnic tables under a covered area. Because it is outside, it is pet friendly. The tables are decorated with succulents and the surrounding landscaping is lush enough that it feels a lot greener than most parts of typically industrial Wynwood.,Water pitchers and disposable cups are available, but because they use a refillable glass pitcher, you can also bring your own water bottle and fill it on your own if you're trying to minimize your waste."
"56 NW 29th St, Miami, FL 33127",6/6/2018,$$,5,della bowls,"Favorite vegan place in Miami!! I come all the way from Aventura just to get a bowl , hope to see it soon near Aventura"
"56 NW 29th St, Miami, FL 33127",12/2/2016,$$,5,della bowls,"First off, I am not a vegan but I loved this place!! I was introduced to Della by a friend who has been a vegetarian for a while now and she recommended this while we were at Wynwood Yard. I'm so glad she did!! Whenever I think vegan, I've always thought of super healthy, dry, not very pleasant vegetables. This was the total opposite. Della has their signature mixed bowls or you can build your own. There are smoothies and desserts. They also have salads. The staff was very nice and was able to answer all our questions. ,I built my own half and half bowl, which is two of every category. I got quinoa and black coconut rice(forbidden rice) with tempeh, chickpeas, crispy broccoli, sweet potato, toasted almonds, pico de gallo on the side, and the yellow curry cashew sauce along with the green garlic here pesto sauce. This was packed with nutrition and full of flavor. Blew my mind. The chickpeas were soft, tempeh was tangy ginger tasting, the broccoli was perfect, the pico was refreshing. I loved the black rice. It's so fragrant and absorbs the sauces very well. Never knew I would crave a vegan rice and veggie bowl but if all vegan food tasted this good, I'd consider dropping meat!"
"56 NW 29th St, Miami, FL 33127",2/9/2018,$$,3,della bowls,"I'm gonna be honest - I'm vegan and I make nutri bowl/Buddha bowl often. I'm used to eating and working with the same ingredients as Della Test Kitchen serves. I had the make-your-own bowl and I was disappointed. For almost 12$ I got a bowl of rice, with sweet potato, tempeh and pico de Gallo (which tbh must have been dirt cheap to make). I just feel like it's overpriced for a vegan dish that doesn't require that much effort and when it's from a FOOD truck. Food truck food shouldn't be expensive lol! Anyways, the bowl made to order wasn't impressive and I won't be going back when I can go down the street to a REAL restaurant to get a fresh wrap or bowl for cheaper!"
"56 NW 29th St, Miami, FL 33127",6/17/2017,$$,5,della bowls,"Miami needs more places like Dellas. Absolutely love their bowls. I typically build my own and mix and match ingredients. My best bowl combo: black coconut rice, tempeh, broccoli, avocado, and yellow sauce. The yellow sauce is a coconut curry cashew base; it's so good you'll want extra (only $1 - get the extra sauce, trust me). The bowl is the perfect size to fill you up, but you can always get a super-sized bowl when you're feeling extra hungry. Love the set up of the place in Wynwood Yard - great for a casual al fresco lunch. My one suggestion is for Dellas to get some stronger fans around the seating area; it gets super hot there in the summer. Besides that, keep it up Dellas. Love what you're bringing to the Miami vegan scene."
"1679 SW 107th Ave, Miami, FL 33165",2/13/2017,$$,5,107 Taste 味,"Super authentic, absolutely loved the ramen. Moshi dessert was also really tasty. I can't wait to come back and try more off their menu. They're very kind and accommodating for any dietary restrictions like vegan or vegetarian. Would definitely suggest checking this place out. Their inside a Plaza so there's tons of parking."
"1679 SW 107th Ave, Miami, FL 33165",11/10/2017,$$,5,107 Taste 味,"I'm extremely pleased with the food here very delicious, I ordered the Thai fried rice (vegan style) and my sister ordered the spicy ramen soup, we weren't familiar with the menu so the person taking our order took time to explain it to us & accommodate to my vegan diet! Amazing service and awesome food! :)"
"1679 SW 107th Ave, Miami, FL 33165",3/16/2017,$$,4,107 Taste 味,"Place is a little expensive but worth it on a treat yourself kind of day, I love the vegan gyoza and the taro bubble tea, the bubble tea was especially sweet and so good! I've been there 3 times and the only thing I didn't like was their vegan sandwhich, the bread was stale and the sauce didn't really taste that good, but other than that, I fully recommend their desserts, their tea, gyoza, soup etc etc"
"1679 SW 107th Ave, Miami, FL 33165",8/10/2016,$$,4,107 Taste 味,"Was bored of the usual coffee places nearby when I found this little cafe. Had their spicy Raman and vegan gyoza. The spicy Raman was really good and the gyoza was ok.. I wish they introduce chicken gyoza also. I had their coffee frappe and my friend had the green tea frappe. ,Too full to try the raindrop cake but I m coming back soon to have it. ,Yes! They have the raindrop cake!!"
"1679 SW 107th Ave, Miami, FL 33165",3/29/2017,$$,5,107 Taste 味,"Went here for a little lunch date with my best friend. Sadly, they were out of vegan gyoza but I got the tofu sampler instead. I love tofu, and that dish wasn't huge but it was so yummy and it filled me up, especially with the large tea I ordered. I can't wait to go back and try more of their vegan options!"
"1679 SW 107th Ave, Miami, FL 33165",10/18/2016,$$,5,107 Taste 味,I absolutely love this spot! The food is so yummy and delicious. I enjoy coming here because it has a great ambiance! I also enjoy the vegan options! This place is definitely a favorite of mine ! I love bringing my friends here. The employees are also very attentive and endearing!
"1679 SW 107th Ave, Miami, FL 33165",9/29/2017,$$,5,107 Taste 味,I go to this place all the time because of its location. Love their vegan spicy ramen and their Yaki Udon. Definitely a vegetarian friendly place with options for everyone. You can't leave here without having their Zombie Plant dessert. It's sooooo good. I love watching it transform and then devouring it moments later. Can't wait to try their other desserts. Would love to see some new vegan/vegetarian options on the menu in terms of entrees but I love what they have right now so no complaints.
"1679 SW 107th Ave, Miami, FL 33165",8/1/2017,$$,5,107 Taste 味,"On my top 5 of best hole in the wall Asian restaurants in Miami. Delicious options for everyone including vegan or vegetarian. Tastes very authentic and leans towards Korean flavors and inspirations. Dessert, dinner, or just coffee are all wonderful choices. I've been numerous times but my favorite dish is the Spicy Ramen."
"1679 SW 107th Ave, Miami, FL 33165",11/25/2016,$$,5,107 Taste 味,"If you're vegan and love Thai food, this is your place. The menu is plentiful and the food is delicious. Best of all, the staff is so very pleasant and accommodating to changes. If you have a dietary restriction, I highly recommend."
"1679 SW 107th Ave, Miami, FL 33165",10/18/2017,$$,5,107 Taste 味,"107 Coffee & Desserts is my favorite place right now, either to have some lunch with a friend or to do my school work. The environment is very enjoyable, staff is nice and friendly, and food is amazing . I come here at least twice a week. Vegans and Vegetarians, I highly recommend this place. It's always a struggle to us finding places to eat, but you will feel appreciated here."
"1679 SW 107th Ave, Miami, FL 33165",12/18/2016,$$,4,107 Taste 味,"I'd never expect to find this place in the shopping center where it is. The staff is so friendly (Asian) that they gladly made Cuban coffee for a local woman who came in yelling asking if they had any. I've had the tofu pad Thai, spicy ramen and veggie gyozas and all are pretty great. Not the best pad Thai I've had but definitely the best tofu I've ever had. Most of the menu options can be prepared vegan or vegetarian. They'll assume you'll want a fork, so extra points if you ask for chopsticks instead."
"1679 SW 107th Ave, Miami, FL 33165",10/15/2017,$$,5,107 Taste 味,"This place is one of my faves! It's quaint with modern yet rustic decor. The menu is written on a huge chalkboard and ordering is done at the counter. The food is delicious, I've been there a few times and have not been disappointed. Try the Korean rice bowl, the portion is large and the flavors are on point. Surprisingly the desserts are also good. The strawberry crepe is amazing! Light & fluffy and not too sweet. They also have vegetarian and vegan options which is a huge plus. Service is friendly and there is plenty of free parking available."
"1679 SW 107th Ave, Miami, FL 33165",10/27/2017,$$,5,107 Taste 味,"Absolutely my favorite place ever. The staff is beyond amazing. I always get taro or coffee Boba here, and the vegan gyoza. The only thing is that I wish they had LOWER PRICES. this is next to fiu and a lot of my friends don't like to go since a bowl of noodles is $13. It is a bit over priced. But nonetheless AMAZING food. Amazing staff. Amazing decoration"
"1679 SW 107th Ave, Miami, FL 33165",7/9/2018,$$,5,107 Taste 味,"What a great little restaurant. Really polite service, especially from Vanessa who I had a very nice conversation with at the bar. Vegan options are also available. I had the Pad See Ew with tofu and no eggs and it was delicious. I will definitely be coming back!"
"1679 SW 107th Ave, Miami, FL 33165",2/12/2018,$$,5,107 Taste 味,"I lost track of how many times I've been to this gem. After a long day of studying, it's so comforting to indulge myself in a hot bowl of ramen. Flavorful food and divine desserts. The Spicy Ramen is amazingggg. It doesn't matter if it's chicken, shrimp, pork, or tofu; they're all lovely. They also have a ton of vegan options which is a huge plus. Make sure to leave room for dessert! My favorite dish here is the Zombie Plant! Only order it if you have enough time to wait for it to be prepared because it does take a long time (~25 minutes). I promise you it is worth every second. It has layer over layer of ice cream, fruit and pound cake all topped with ""dirt"" and served with milk on the side to pour over. It is to die for!"
"1679 SW 107th Ave, Miami, FL 33165",1/8/2018,$$,3,107 Taste 味,"I found this place while looking for vegan/vegetarian friendly places. Loved the spicy ramen. All tough the menu says to advise them if you are VEGAN, DO NOT, been here three and times they have practically laughed in my face all of them. Matcha latte, recommended as well as the vegetable steamed dumplings. Downside, the plastic utensils. Love the menu options and ambience, only wish they were more mind-full of peoples dietary choices."
"56 NW 29th St, Miami, FL 33127",4/20/2018,$$,5,della bowls,"I've been there twice and would come back again! It's great for vegans and vegetarians! Food is delicious, one of my favorite bowls is the Caribbean. You may choose from a variety of options from beans, green veggies to quinoa and brown rice. ,I find the price inexpensive compared to other places I've been to within the area of Wynwood. It is worth trying at least once! ,Service wise, I cannot say a lot because it kinda of work like a fast food truck with the difference that this is healthy food. ,A great plus is that you can seat there and relax listening to live music from the Wynwood Yard! I love it!"
"56 NW 29th St, Miami, FL 33127",8/9/2018,$$,3,della bowls,"Well I am usually a fan of anything vegan even though I am not a vegan myself. I was very excited to try the Caribbean bowl. Got it delivered very quickly with Uber eats and I also ordered the Cocoa Berry Bliss smoothie. ,The bowl had a nice presentation.  The kale greens were very bright and beautiful.  The avocado was also very black inside and had a very bitter taste. I would have preferred if the avocado was maybe sliced instead of a half just placed in the center.I usually love plantains in vegan bowls but some plantains were rock hard and others were ok. There was nothing very special about the bowl and I did not finish it because of the sour taste from the avocado and the hardness of the plantain. The Yellow Sauce had a nice flavor but also nothing special. ,The smoothie was not a smoothie at all. I could barely drink it. It was so chunky and I was not able to drink it. ,The best thing honestly was the pico de gallo which is usually not hard to mess up.,I really wanted to enjoy my meal and I really hate spending money on horrible food but this just wasn't for me. I would try again in the future but not anytime soon."
"56 NW 29th St, Miami, FL 33127",6/6/2018,$$,4,della bowls,"we were on vacation with the family in Miami and decided to have a vegan meal. Seeing prior reviews, we decided to go down to Wynwood and give Della Bowls a try.,The food was made to order and the bowls were tasty. My wife decided to create her own bowl while I went with the Southwest bowl. We both enjoyed our meals and the servings were plentiful. ,The dessert options were very nice and the brownie sundae was awesome. ,The venue was very fun and the live music was great. ,We would definitely recommend this spot for a casual vegan meal with friends."
"56 NW 29th St, Miami, FL 33127",6/11/2018,$$,5,della bowls,"The perfect place for anyone who's looking for delicious vegan options. They're located inside the wynwood yard and best of all, they're also available via Uber eats! I had the southwest bowl- very spicy, but very tasty if you can handle it. i also had the cocoa berry bliss smoothie. Definitely planning on trying some of their other bowls soon :)"
"56 NW 29th St, Miami, FL 33127",7/28/2018,$$,5,della bowls,"i'm obsessed w della!! idk how i haven't given this 5 stars yet, i should have reviewed this place years ago! ok so-- i like the option of building your own bowl (i get the half and half form more options) or the premade bowls. everything is vegan and wholesome and you don't feel like crap after you eat it. i could drown everything in the green sauce. the food is always fresh and worth it's,value. the service is always good. one of my fav restaurant atmospheres--you never know who might be playing on the stage a few feet away ;) outdoor, care free, cozy vibe. great either during the day or at night. you can tell there was a lot of soul put into this."
"56 NW 29th St, Miami, FL 33127",12/2/2017,$$,5,della bowls,"Love this place!!! Delicious and healthy. If you are in the area and looking for a filling vegan option, this is the best place to go! The atmosphere  is fun, the food is fresh, the sauces rock! I can get enough of Dellas!!!!! ,The Wynwood Yard has tons of fun events, totally worth checking it out, there are several food options but I always find myself grabbing a meal at Dellas!"
"56 NW 29th St, Miami, FL 33127",4/10/2018,$$,5,della bowls,"Love this place the peanutbutter cup and build your own bowl amazing!!!! I dream of the vegan peanutbutter cup ,Always such sweet and nice service  nice"
"56 NW 29th St, Miami, FL 33127",3/1/2018,$$,3,della bowls,I am not sure if I really like this place yet or not. I ordered the Caribbean bowl on my the first time there.  The black coconut rice was way too hard. I devoured ot though because that's what a hangry person does.  I do have to admit and say the curry sauce was great! The bowls come in a large bowl... extraaaa large that is! There is ample space st the tables to sit amd enjoy your meal.  On my second time there.... I ordered the Dalé bowl. Meh.  It was alright.  Not the best. I think the flavor pairings for that bowl should be reviewed. It is a test kitchen. I came back again for a third time but did not order.  I sampled the tempeh. It was cold and dry. I wasn't really impressed. It is definitely not a bad option for a vegan meal considering the other options offered at Wynwood Yard.
