address,date,price,rating,restaurant,text
"4600 NE 2nd Ave, Miami, FL 33137",5/5/2015,$$,4,Lemoni Cafe,"We finally made it out to Lemoni!! It was the husbands idea too, although I've had this little gem bookmarked for years. We arrived on a Sunday at around 5:15pm,  glanced the very extensive menu, and ordered a bottle of wine (it had been a long day). Another couple came in a few minutes after us and asked at what time the place closed and out waiter tells them 6pm as he was pouring my wine. I thought we were going to be rushed out of there, but none at all. The service continued to be as great as if we had arrived hours before closing. Now the food...I am a diehard sandwich lover. I can live off sandwiches for the rest of my life. This place is a panini/sandwich lovers mecca. Lots to choose from, even vegan/veggie options if thats your thing. My husband got his inner vegan on with a black bean burger panini which he devoured. You could tell that the patty was fresh and homemade b/c it had beans coming out of it..I on the other hand ordered the meatball parm sandwich which paired delectably with the Malbec. The meatballs were the perfect size and also fresh tasting.  I can't wait to come back and try some of their other panini options. My advice to any yelpers out there is to remember they close early, 6pm on Sundays. They did turn away a few patrons that arrived at 5 till, so they do mean business!"
"4600 NE 2nd Ave, Miami, FL 33137",6/20/2015,$$,5,Lemoni Cafe,Great place! The vegan plate was an amazing option with the most delicious vegan coconut cutlets served with vegan mozarella.
"4600 NE 2nd Ave, Miami, FL 33137",6/4/2015,$$,3,Lemoni Cafe,"Good decor, many vegan options and perfect for a low key first date"
"4600 NE 2nd Ave, Miami, FL 33137",1/16/2016,$$,5,Lemoni Cafe,"INCREDIBLE!!! I cannot believe this is my first time coming here, and I'm so glad I did because this is now my new favorite little cafe here in Miami. You will not be disappointed by the vegan options. In fact, I dare say it's one of the best vegan sandwiches I've had in Miami! I had the vegan cutlet sandwich with a side salad and a smoothie. AMAZING! Amazing service, casual and quaint ambiance, and an overwhelming large selection of vegan options. I'm definitely a fan and will be returning soon!"
"4600 NE 2nd Ave, Miami, FL 33137",8/19/2015,$$,5,Lemoni Cafe,Best food!!! Omg!! If you are vegan or vegetarian this place is over the top !! We had soo many choices..we for sure over ordered..everything was amazing..we had several salads..soup ..hummus ..sandwich which was made of coconut heaven..tiny place!! Excellent service..reasonable prices..for sure coming back
"4600 NE 2nd Ave, Miami, FL 33137",9/15/2015,$$,5,Lemoni Cafe,"This place never fails. Food and service is ALWAYS GREAT! Vegan options, must try paninis!"
"4600 NE 2nd Ave, Miami, FL 33137",10/12/2014,$$,5,Lemoni Cafe,"This place is pretty awesome so far.  Great menu, service has been good, and food has been great.  Plan on returning many times.  The Sunday meatball parm is very good.  They even have multiple vegan options."
"4600 NE 2nd Ave, Miami, FL 33137",6/1/2015,$$,4,Lemoni Cafe,"Love dining at Lemoni Cafe! Hands down the best service in Miami. The servers treat you like family and always have a sense of calm even when they get quite busy. The food is outstanding as well, their menu is extensive and has options for everyone omnivore, vegetarian, and vegan alike. I myself am vegan and highly recommend the coconut breaded tofu panini with 3 bean salad, but everything I've tried in the last 4 years has been excellent!"
"4600 NE 2nd Ave, Miami, FL 33137",7/28/2016,$$,5,Lemoni Cafe,Excellent excellent! The staff was really friendly and knowledgeable about vegan food! I had a Veggie Quesadilla that was extremely tasty! With a vegan mozzarella that tasted better then regular mozzarella. Def recommend!
"4600 NE 2nd Ave, Miami, FL 33137",8/14/2016,$$,5,Lemoni Cafe,"This place deserves a 5 simply because of how unique the restaurant is as a whole. My cousin was living in Midtown for some time, and we would always order from this cafe. The food was always fresh but the wait sometimes was a bit long. Although I must admit, I am a fond advocate that if the food is amazing, I will wait a bit more time for an amazing meal. I would always order the chicken salad!!! So much flavor! Everything is spectacular! They have a huge selection for vegan and vegetarians which is the best!!! Since I don't eat that much meat! I promise you, this place will not disappoint! They know what they are doing."
"4600 NE 2nd Ave, Miami, FL 33137",1/10/2014,$$,3,Lemoni Cafe,"I've only ever had food delivered from here through the Yelp app, which uses Eat24 to execute the order. I was very pleased to find they have vegan/vegetarian options right on their menu, so I didn't have to cobble a meal from side dishes like I'm used to doing as a non-cooking vegan!,I chose the Veggie Lover's Panini which was bursting with roasted vegetables, including peppers, mushrooms and eggplant. My fault for forgetting to tell them no cheese, but I was starting to forget (and miss!) the taste of the gooey melted Provolone anyway. I picked chips for the free side of chips or greens, and it came with a small bag of plain Lay's.,Including a $2 delivery fee, my order came out to $11.63 before tip. Considering they were willing to trek all the way to me at The Venetia, I definitely got the better end of that bargain. Great meal, and would order from or visit again!"
"4600 NE 2nd Ave, Miami, FL 33137",12/20/2015,$$,5,Lemoni Cafe,"A hidden gem! Casual and eclectic atmosphere, this place looks like it easily doubles as a quirky cafe and lowkey lunch or dinner spot. A huge range of food options, especially for dinner. And many vegetarian/vegan, a big plus. But most importantly, everything my table ordered was excellent. Even something as simple as a chicken wrap was filled with unique and delicious flavors. Other favorites: Hummus, Tabbouleh, Coconut breaded vegan cutlets.,Definitely returning often."
"4600 NE 2nd Ave, Miami, FL 33137",11/18/2016,$$,5,Lemoni Cafe,"Great little place with big flavor and vegan options. The house specials that include vegan meatballs and a tofu caprese salad are generous and serious supreme gourmet. They could sell their vegan Parmesan cheese and make a fortune. Bella. I hope that they can expand to the empty retail space next door,"
"4600 NE 2nd Ave, Miami, FL 33137",8/27/2015,$$,4,Lemoni Cafe,"The food is good, the atmosphere is even better! A little hole in the wall in Miami's Mimo District, Lemoni Café really transports you to a little chic European café. And they have amazing vegan options!,Ambiance: I usually start off with food, but this place is really all about the ambiance! The absolute perfect date night spot, especially for a first date (and it's near Wynwood so if you're feeling each other make your way to one of the breweries!). There's so much character in the decor, the colors very rich and warm so you just feel so at ease and comfortable. It's tiny and just down to earth! ,Food: I really liked the food! They have an extensive menu with everything from sandwiches to salads to vegan entrees! Perfect place for vegans & non-vegan friends to come because there is something for everyone! I ordered the Vegan Platter and Jesus! Food for 3 meals easily! Came with quinoa, whole wheat pita, sautéed veggies, hummus, VEGAN MOZZARELLA, strawberries with mint, and coconut meat breaded with oatmeal. Absolutely freaking delicious and super filling! I couldn't get over the vegan mozzarella. My date ordered the chicken quesadilla and he said it was really good too! They don't have a large wine or beer menu, but they have some great craft beers including Dead Guy Rogue which is my absolute favorite! I really wanted their vegan cookies, but they were out. Next door they have a pizzeria with vegan pizza, can't wait to try that!,Overall, cute, quaint, good food, large menu selection, limited wine & beer, and vegan deliciousness! Highly recommend this place for a simple dinner date."
"4600 NE 2nd Ave, Miami, FL 33137",8/2/2016,$$,4,Lemoni Cafe,"Cute lil cafe in Midtown, vintage decor and vegan friendly menu! I tried their avocado and sundried tomato pannini with vegan mozzarella cheese and a side salad...wow! this sandwich was soo good and filling! I couldn't finish it all so took the other half home. Our waitress was nice and attentive. The space is very quaint and inviting. I will def be going back to try more of the items on their menu."
"4600 NE 2nd Ave, Miami, FL 33137",6/2/2014,$$,4,Lemoni Cafe,"I heard Lemoni Cafe have some vegan options, so after taking my car to have their oil change, I decided to stop here to have my tank fill-up. It was Saturday, lunch time. Parking was a breeze behind their building. Sweet.,The place its charming, really charming, tiny of course, and I really dig their vibe with the Spanish rock playing. The waitress was very helpful with her recommendations, a big plus. They have a menu call Conscious Cuisine, which I found really cool, with an array of vegan pizzas and some other stuff that right now eludes me. ,I ended up having a Portobello Paninni, that comes with a salad and a vegan strawberry cone for dessert. My only complaint. They just carry soy milk (Soy its a big No-No in my book) as an alternative for their coffee. Wouldn't be nice to have almond milk as well, so patrons can have a super yummy almond cappuccino and feel happy? Just a thought.,Overall, I had a great lunch. I will definitely be back, next time with my vegan tribe."
"4600 NE 2nd Ave, Miami, FL 33137",8/29/2015,$$,4,Lemoni Cafe,"Probably the smallest cafe in Miami with the biggest menu. You could seriously eat there every day for months and never order the same thing twice. Incredible selection of really well done healthy dishes and many vegan options. This will be my go-to place for take out and delivery as well. Great local cafe feel with very tight limited seating...you will get to know the folks eating next to you. ,The vegan meatballs were amazing, as well as the veggie wrap. Every dish that came out of the kitchen whizzed right by our noses, and they all looked amazing. Portions are large, so didn't make it to dessert. Desserts are home made and looked insanely good.,I would have given it 5 stars, but it was difficult getting our servers attention throughout our brunch. I completely understand that it was a packed Saturday, but there really aren't too many tables, so."
"4600 NE 2nd Ave, Miami, FL 33137",7/28/2017,$$,5,Lemoni Cafe,"Great great Vegan and vegetarian sandwiches. They are big also.  I am never to crazy about their soups, they need to improve by a lot and most important, they need to be hotter and less salty.  If you have never been, give this guys a visit. Its a small charming place.,Parking on the street is a bit difficult and in the back they seem to have parking, they only problem is that the gate to the parking lot is sometimes close. ,Anyways, the food is what is more important and the food here is great."
"4600 NE 2nd Ave, Miami, FL 33137",4/11/2018,$$,4,Lemoni Cafe,"I enjoyed my lunch here ALOT.  I got the salmon on a fresh whole wheat baguette (note: bakery fresh , not from a bag).  The garlic aioli was delish and the salad was fresh and tasty.  I reserve 5 stars for the super high end amazing experiences - this was pretty great as a lunch place. My friend wasn't happy because her quesadilla had  real cheese, but since they had a vegan quesadilla on the menu and she didn't order it, I have to side with the restaurant.  I don't think it was their fault.  The quesadilla looked very tasty, even though I didn't get to taste it. I like the funky relaxed vibe.  Definitely would come back to try other things in the future."
"4600 NE 2nd Ave, Miami, FL 33137",8/15/2017,$$,4,Lemoni Cafe,"I've been a regular for years.  Great quality food and some yummy vegan options.  The BF and I like to come here because there is such a large variety.  You can find something for anyone's craving.  Sometimes you can be waiting a while and seating is a little cramped, but no biggie.  They will also deliver through Eat24."
"4600 NE 2nd Ave, Miami, FL 33137",8/10/2017,$$,4,Lemoni Cafe,"So good. Went for breakfast and wasn't disappointed. The food was fresh and delicious. I had the 2 eggs and home fries. LOVED the home fries! Meal was very filling and reasonably priced. I would love to go back for lunch since the sandwiches sounded interesting. I am a meat eater but the vegan/vegetarian options sounded very appetizing and interesting, not your usual salad only type of meals. The only downside is the parking which was tricky and uncomfortable."
"4600 NE 2nd Ave, Miami, FL 33137",2/21/2018,$$,5,Lemoni Cafe,"Awesome little place with fresh wraps and paninis. Soups, appetizers and bites are also good choices. Lots of vegan and vegetarian options on menu too. Owner is super nice.  Small place so you want to get there early of late to mIss the lunch crowd and they do a lot of takeout business as well. Definitely worth going. This was our third or fourth time there, and food never disappoints."
"4600 NE 2nd Ave, Miami, FL 33137",1/4/2018,$$,5,Lemoni Cafe,"Wonderful! I ordered via Uber Eats . It is always so Fresh and the preparation is so tasting. I am not a vegan or vegetarian, but I always end up eating a wonderful Vegetarian dish, one of my favorite is the Chickpea & Quinoa Salad avocado, cherry tomatoes, onions, feta, corn, and cilantro. served with toasted ciabatta bread . It's helping my Weight Watcher plan. It's perfect for my 2018 Resolution.  My husband loves their Philly Cheesesteak Sandwich mayo, grilled onions, green peppers, mushrooms, and provolone. your choice of bread and your choice of side.  if you need any changes they will always try to accommodate, great place and great people."
"4600 NE 2nd Ave, Miami, FL 33137",10/24/2017,$$,5,Lemoni Cafe,"I love this place. Such healthy ingredients and amazing food. It's so tiny in there though so expect a wait on a busy brunch day. It's always good and the staff is always sweet. I've had so many things on that menu but the black bean burger is so goooooood. Greek salad is awesome. Great choices for vegans and vegetarians. Super cute inside. Like I said, not spacious at all."
"4600 NE 2nd Ave, Miami, FL 33137",11/22/2017,$$,5,Lemoni Cafe,Best restaurant for vegans and non vegans to eat together ! There's a ton of vegan options and cheeses as well as normal food and they have no problem replacing something you see on the menu with a vegan option.
"4600 NE 2nd Ave, Miami, FL 33137",1/4/2015,$$,4,Lemoni Cafe,"Not sure what took me so long to ""discover"" Lemoni. Fear of being run over by a Haitian driver perhaps? Ouch. Had to go there. No really, I liked  this charming little cafe and I love that they offer a few vegan options. What they should also add is some gluten-free corn or brown rice tortillas instead of all the wheat breads and wraps. ,My daily special, a grilled faux meatball panini with vegan mozzarella, portabella mushrooms and marinara sauce, was totally delicious. The vegan cheese was actually really good, as was the faux meat made from oats and coconut. Sounds strange, but with the marinara sauce and smoky mushrooms, it worked.,Their dessert offerings are great (brownie a la mode, cheesecake, bread pudding and vegan cupcakes). I am a bread pudding feen. Their cinnamon raisin version with nutella is legit, right up there with Morgan's, Blue Collar and City Hall. And for $6 you get a huge portion. I am not a big fan of raisins and usually prefer some sort of fruit or chocolate in my bread pudding, like Morgan's does. I also didn't notice any nutella in it but overall it was still a very good traditional BP.  I'd pay them a visit just for that (and probably will)."
"4600 NE 2nd Ave, Miami, FL 33137",9/10/2017,$$,5,Lemoni Cafe,My favorite neighborhood restaurant. Vegan & vegetarian friendly. Great staff & amazing food. You definitely get what you pay for!
"4600 NE 2nd Ave, Miami, FL 33137",7/7/2017,$$,5,Lemoni Cafe,"I been coming here for a while and I never had an issue. Everything is always delicious, vegan choices, healthy options . Service is usually great The wine are always with a decent price. I really recommend this place"
"4600 NE 2nd Ave, Miami, FL 33137",6/19/2017,$$,4,Lemoni Cafe,"This place is great. I went to eat there with my mother & even though they had a staff meeting inside their restaurant, they still sat us down outside & took care of us. Extremely nice staff. I ordered hummus & pita bread as an appetizer (among other things) & the kind of pita bread they served, was probably the best pita bread I've ever tried. As an entree, I had the vegan quesadillas. I was not disappointed. Definitely a place you have to try for yourself & explore their large menu. There are so many options to choose from."
"8376 SW 40th St, Miami, FL 33155",6/20/2013,$$,4,Kon Chau Restaurant,"Kon Chau dim sum on a lazy afternoon. This place is understated. Heavy traffic at weekend brunch time, but otherwise peaceful. The food is fast, delicious, and inexpensive. A vegetarian (not vegan) and a meat eater will both leave satisfied. The dining area is simple and unpretentious, unlike many Miami 'pan-Asian cuisine' type places. Dreamy dreamy dim sum is the real deal. ,...and my little brother was digging on the smooth sounds of the 70's."
"4600 NE 2nd Ave, Miami, FL 33137",5/27/2018,$$,5,Lemoni Cafe,"I went here today for the first time at my son's request. He's vegan, so there are a lot of options for him here. We arrived around 2:30pm on a Sunday. There were 4 people ahead of us. There were no seats available. There were seats outside, but we were a party of five and all of the tables are 2-tops and can't be moved around. We waited for almost an hour to be sat. I wasn't too happy about that, but it wasn't the staff's fault. There was a table there with their to-go boxes since we arrived, and they just sat there talking for almost an hour after paying! ,The menu is great. Something for everyone! I have very picky eaters in my family. My husband got a meat empanada that was amazing! Then he had a gyro that was also really good! My son had the Mediterranean platter. It was huge and everything was delicious! He also had an order of the vegan meatballs (it comes with 2). They were super good! We shared a plate of the Home potatoes. They were good. My daughter had a Cesar salad and ate every last bite. I had a portabella mushroom and goat cheese sandwich. It was amazing! I really didn't expect much from the place, but they really make every single item very tasty! I wasn't even that hungry, but I ate the entire sandwich. ,It was also very reasonably priced. We all had waters, but the bill was only $65. My son had a ton of leftovers. ,Even though it's a far drive for me, I'll definitely be back. It was worth the long wait."
"4600 NE 2nd Ave, Miami, FL 33137",5/7/2018,$$,5,Lemoni Cafe,"Light yet filling, I left feeling brand new! I had the Bean Burger wrap with three bean salad (completely vegan) and was completely satisfied. Even took half of the wrap home. Incredibly affordable, too.,I honestly can't wait to go back and try something else. They have so many great options that cater to any and all dietary needs!,Really great, local ambience. Cute, homey decor. Street parking was pretty easy to find."
"4600 NE 2nd Ave, Miami, FL 33137",12/24/2017,$$,4,Lemoni Cafe,"Lemoni Cafe is a charming little spot great for lunch or dinner. Located in Miami Design District's Buena Vista is this beautifully decorated restaurant offering a wide variety of options on the menu to choose from. Take note to the many wonderful vegan and vegetarian options also! The menu is filled with options ranging from small bites, salads, entrés, daily specials, paninis, wraps and so on. Treat yourself to a fresh smoothie or pick from the many different brewed coffee selections. ,Seating was quick which was great for us as some of us had flights to catch that day back to Chicago including myself. We were a group of 5 that came in on a Saturday for an early lunch and we were seated immediately. Upon being seated you are served water infused with fresh mint- very very refreshing. All of us at the table are plant based eaters. We had a wonderful time trying each other's wraps, the vegan quesadillas are really good and so is the caprese sandwich. I had the Tuesday special even though it was Saturday. It was served with a 3 bean salad- very very tasty! ,I would definitely go back to Lemoni Cafe next time I'm in Miami! The group that I was with dines there weekly and everything that they recommended on the menu was delish! If you are ever in Miami check in to Lemoni yelpers and you won't be disappointed!!"
"4600 NE 2nd Ave, Miami, FL 33137",7/5/2017,$$,4,Lemoni Cafe,"Had lunch here and was pleased to see so many vegetarian and vegan options. The menu is huge - so many great items to choose from. I opted for the hummus appetizer and the veggie quesadilla as my entree, and was happy with both dishes. The hummus was flavorful, everyone loved it. The quesadilla portion was really big, enough for me to take some home. My one qualm is that it was a tad bit on the greasy side. Other than that, love everything about this place and will be coming back for more!"
"4600 NE 2nd Ave, Miami, FL 33137",12/5/2017,$$,4,Lemoni Cafe,"Delicious! I ordered via Uber Eats and everyone at the office was pleased with their meals. Fresh quality food prepared perfectly. It's hard finding restaurant options as a Vegan to eat alongside non-Vegans, but this menu is extensive and you're sure to find an option for everyone. My Vegan Meatball Sub on a whole wheat baguette came with a side salad and was superb, a bit skimpy on the marinara/tomato sauce, but fantastic flavors nonetheless. Everything was hot and fresh and the salad dressing was amazing. I also loved my avocado, date, spinach, mango, and almond milk smoothie. I can't wait to dine in Saturday or Sunday for Brunch, maybe then I'll give it the 5 stars it likely deserves."
"701 S Miami Ave, Miami, FL 33130",3/17/2018,$$,5,American Harvest Co,"Black bean hummus to DIE for!!! Other two: black bean bowls (kale, pumpkin seeds, carrots, onion, garbanzo and black beans in a lemon vinaigrette topped with guacamole). Everything on the menu is non-GMO, hormone free and super vegan friendly :) HIGHLY recommend"
"701 S Miami Ave, Miami, FL 33130",2/3/2018,$$,5,American Harvest Co,"LOVE ! Love this place, the food is really good and they have options to customize to a vegan order. I Always order the Cuban Hipster Bowl without the cheese. The ppl are super friendly too!"
"701 S Miami Ave, Miami, FL 33130",1/26/2017,$$,4,American Harvest Co,"On a vegan diet for a month. This place has a few vegetarian options. Has to substitute a few things. I ordered the hipster bowl and it was very flavorful imagine adding some protein to that!! And the curry bowl was very healthy and yummy. It was like a home cooked meal. Portions are very filling and prices are great. I can't wait to try everything else on the menu. ,Please get a baby changing table in your bathroom!"
"791 NW 20th St, Miami, FL 33127",10/7/2014,$$,5,Smart Bites Cafe,"This place is perfect! Savory, sweet, light, filling... Whatever you want. Herbs and fruit grown with recycled materials and has a ""homey"" inviting ambience. Plenty of vegetarian & vegan options. ,Everything tastes good, practically everything is healthy, I hope it stays for a long time."
"791 NW 20th St, Miami, FL 33127",3/21/2016,$$,5,Smart Bites Cafe,Oh my sweet baby Jesus. As a vegan it's hard for me to find places to eat this location came up while I was near the area. First off they deliver and they are like a concierge service when you call in so helpful and patients from the call to the delivery the service was impeccable. Now about the food. The veggie burger touched my soul ( not sure if I'm just starving but this thing is beyond delicious) vegan friendly cream broccoli soup and carrot cake. To a vegan goody this is music to my taste buds. This place is a must try
"791 NW 20th St, Miami, FL 33127",8/4/2016,$$,5,Smart Bites Cafe,Found this spot on Yelp. My brother wanted lunch and he prefers clean eats and vegan meals at times. This was a perfect choice. The spot was clean. Service was friendly and quick food was fresh and delicious. I would recommend them to others who like more natural food options.
"791 NW 20th St, Miami, FL 33127",1/15/2018,$$,5,Smart Bites Cafe,"I'm not a vegetarian or vegan. Someone recommended the black bean cricket burger. It was amazing! Additionally, the ambiance is very relaxed. The garden is beautiful and helps create the cozy, relaxed ambiance. The food was also very reasonably priced. I look forward to coming back every time I visit Miami."
"791 NW 20th St, Miami, FL 33127",4/9/2017,$$,5,Smart Bites Cafe,"This place is an absolute gem.  Will has created an environmentally friendly urban paradise in the Health District.  The food is fantastic - it's fresh and accommodates every type of diet I can think of (vegan, gluten free, paleo, even keto).  ,I recommend the cowboy bowl, the veggie burger and the cookies.  ,The prices are totally reasonable and the staff is attentive and helpful."
"791 NW 20th St, Miami, FL 33127",3/11/2017,$$,4,Smart Bites Cafe,Had a chocochya burger which was some sort of seaweed burger with seeds and it was so good with the Chipotle mayo! This was vegan and also they have a good selection of vegan foods off their menu. The entire restaurant is very quaint and cozy with lots of plants and water (you will hardly even realize you are next to a major road)
