address,date,price,rating,restaurant,text
"8530 SW 124th Ave, Miami, FL 33183",4/2/2016,$$,5,MyRoots Juice Bar & Kitchen,"Everything is fresh and delicious, from the food to the smoothies and smoothie bowls. The owner is very sweet and attentive. The location is cute and nicely decorated. I heard the owner used to have a cupcake shop. I wonder if she'll ever open a vegan bakery now that this business is thriving."
"3133 Grand Ave, Miami, FL 33133",6/6/2012,$,4,The Last Carrot,"I went to The Last Carrot for lunch today and it was absolutely delicious! I had the felafel pita sandwhich. The pita bread was very thin, so it's kind of a messy sandwhich and I would recommend that you either ask for a fork or keep it wrapped up as you eat it. The sandwhich comes with a green sauce, I have no idea what's in this sauce but it is so good. The place is your typical hipster kind of vegan hole-in-the-wall place in coconut grove so you cannot expect it to be so pristine. Everything is natural and made right in front of you so if you don't like what you see you can walk right out. I only gave it 4 stars because of the cleanliness, but the fact that they were preparing my lunch right in front of me was a huge plus! Everyone was very nice it took a few minutes for the girl to acknowledge us, but nothing I would complain about, the bar was almost completely full and she was only one of 2 servers/cooks so it's understandable. I would recommend this place if you want to have a quick, healthy lunch with a home-made feel. I didn't try the juices but they looked amazing and I will be going back to try one."
"3133 Grand Ave, Miami, FL 33133",11/4/2009,$,5,The Last Carrot,"The Last Carrot isn't much to look at, but from the second I walked in the door I knew that I had made it to a little slice of vegan heaven. Instead of trying to decide between Chinese take out classics like Buddha's Delight and Bean Curd & Eggplant or pizza (no cheese) plus a meager list of toppings from the local pizzeria, I had a full menu to choose from including vegan desserts! It had only been a week since I dined at an ultra vegan-friendly restaurant but it seemed like an eternity and I took my time looking over the menu. Would I try the Spicy Tofu Pita Sandwich? Maybe the Hummus Pita? Homemade Veggieburgers are always a safe choice. Or did I want to go for one of their ginormous (yes that's a word, because I say so!) salads. Maybe some hearty soup and a salad. Then there was the prospect of having a smoothie made from real fruit, not concentrated fruit juice or syrups. As I tried to make my decision I looked down to see a huge vegan cake beckoning me to come closer and a full case of vegan cookies and brownies. What's a little Vegan Guinea Pig to do with such choices put in front of her?,For the rest of the review and menu items click here "
"1915 Ponce De Leon Blvd, Coral Gables, FL 33134",3/14/2017,$$,4,Ms Cheezious,"Yesterday I had the crab grilled cheese with vegan cheese, so good! They have tons of different flavored sauces and condiments to choose from too. This place is great for lunch."
"1915 Ponce De Leon Blvd, Coral Gables, FL 33134",4/22/2016,$$,5,Ms Cheezious,"We loved the truck. Got stoked when they opened up a restaurant. Now, we rejoice a restaurant has opened up closer to us. Tricky to find, as they tend to leave the door open (source for the only sign). Look for the pin-up lady cartoon and pure golden. I appreciated that they were able to split the bill, at the counter. Same great food. Awesome service. Quick table turn around/venue kept super-clean. And the bathrooms... You vocals love in there. Wait staff truly cares for your best dining experience. We had the buffalo sandwich (had a nice kick) and the chicken and waffles (gravy tastes homemade). They do have a vegan option. Board games and Condiments off to the side. The midnight snack, a shake with whip cream, chocolate sprinkles, chocolate covered pretzel, chocolate covered Ruffle chip, and caramel corn, was heaven. No doubt, we will be back!"
"1915 Ponce De Leon Blvd, Coral Gables, FL 33134",7/7/2017,$$,5,Ms Cheezious,"HOW can you not give this place 5 stars!? My friends and I had such a great experience. We went for lunch right at noon and the place wasn't busy yet. We got a chance to take in the menu and put in our orders! I went with the crab with avocado and vegan cheese which was SO GOOD! Wow, I mean you can't really mess up a grilled cheese but this spot gives you all the options to make it the best. They have so many different sauces and even offer tomato soup!,My friends got the short rib and other savory meat grilled cheeses which they GUSHED over. Also the mac n cheese was so decadent and rich - definitely one to share! The oreo milk shake was also extremely tasty. Just in awe after lunch here!!"
"11361 NW 12th St, Miami, FL 33172",4/1/2016,$$,5,P.F. Chang’s,"This is the best chain restaurant for a vegan to go! They are so accommodating and have many vegan options compared to other ones. I had the vegetarian lettuce wraps and the ma po tofu and they were so good that my omni family kept eating it!! Everyone loved it even grandma who didn't even know what tofu was. The service is very good every time we go, they are always nice and attentive of our needs and we never have to ask for things like refills. Definitely my favorite pf changs location in Miami. And I've been to pretty much all of them. The staff is also consistent, I've been waited on by the same girl for over two years now and she always recognizes us and asks about anyone who may not have gone to the restaurant that specific day. Hoping to go back soon so I can try the Buddhas feast because I've been scared to try it but not for long. The only thing I would ask for is a vegan dessert because it's kinda horrible watching everyone eating desserts and not being able to have one yourself."
"11361 NW 12th St, Miami, FL 33172",2/9/2018,$$,4,P.F. Chang’s,"I've always been a sucker for mall chain restaurants... There are plenty of options for vegetarians and vegans here. The veggie spring rolls come with chili plum sauce, you can get 2 or 4. There's edamame, salads, and side noodles. There's a vegetarian entree section- I like Buddha's feast (broccoli, carrot, peas, asparagus, mushrooms, tofu with brown sauce) with brown rice. Ask your server about what's in each sauce to be sure. The fried rice he egg in it- you can order without. They also have a nice wine selection. The bathroom was not very clean."
"143 NE 3rd Ave, Miami, FL 33132",1/27/2014,$$,5,Ten Fruits,"I randomly (and happily) stumbled upon Ten Fruits last week on a walk to Bayfront Park. The decor is clean, white, and minimal with facts about healthy foods written all over the walls in a cool newspaper style.  All juices are made from fresh fruits and vegetables with a slow pressed juicer; I learned that this is to retain all of the nutrients that are otherwise lost from the heat and friction of a fast juicer. Juices come in large portions (16 oz) and are bottled with a lid. Ten Fruits also offer salads, Acai power bowls, empanadas, waffles, and quiches, many of which are vegan-friendly. I'm super excited to have found a healthy and delicious place to get my daily serving of fruits and vegetables within walking distance of where I live. I will most definitely be becoming a regular here.,I also hear that Ten Fruits is opening a location in Coral Gables soon!"
"143 NE 3rd Ave, Miami, FL 33132",1/3/2014,$$,5,Ten Fruits,"So I was at Ten Fruits, dropping a deuce in the men's bathroom, when I noticed that the wallpaper surrounding me were these Wikipedia pages of some the most underrated antioxidants known to man (You know, because Yuppies jusy need to be educated). Anyway, I knew about Acai, I just didn't really how to say it -- now I do. With that said, I was very impressed by my Acai bowl, it was even designed like something out of one of those glossy, colorful Vegan recipe books.,But Ten Fruits is cute; something that Miami is looking to transition into, I think. It's always difficult when you're that one organic/health food place surrounded by a bunch of Cuban sandwiches. This place was legit, though, in all honesty."
"143 NE 3rd Ave, Miami, FL 33132",1/9/2014,$$,4,Ten Fruits,"In a nutshell: it's free wi-fi, vegan/vegetarian-friendly, great place for clean eating in the downtown Miami area.,If you think waffles without copious amounts of butter and syrup is criminal, you were not alone, but the whole wheat waffles here are soft and moist without losing their crisp and are tasty topped with fresh fruits and agave. I had the whole wheat waffle + super smoothie combo, with an almond milk latte.,The guy that saw me looking the menu on his way out must have seen my hangover because he suggested the Green Giant, which I can now say is a certifiable cure! It blends avocado, pineapple, coconut water, vanilla and agave for a tasty drink that hydrates and restores electrolytes.,The coffee was okay, they get their beans from Panther which is a popular gourmet coffee shop in the Wynwood Arts District. Unfortunately the almond milk was over-whipped and actually had it's own texture, which made it really hard to keep drinking. I really think almond milk has too thin of a consistency to be properly whipped, so I probably would have been fine if I had ordered my usual soy latte."
"3133 Grand Ave, Miami, FL 33133",1/26/2012,$,3,The Last Carrot,"I like this place, the food is good, they've got a range of vegan and gluten-free options, and the atmosphere is casual, quiet and great for a mellow leisurely lunch. The food is prepared before your eyes in a relatively clean kitchen, free (but limited) parking and cash only (as far as I know). The staff is cordial but the service is glacial whether he place is empty or at peak hours. Don't go for lunch on a week day, you won't get back to work in time even if you ask for takeout. I would recommend ordering by phone and picking up."
"3133 Grand Ave, Miami, FL 33133",10/25/2010,$,4,The Last Carrot,"Fresh papaya juice and wheat veggie pita with hummus. Health Nut list to the max. The great Vegetarian and Healthfood Counter in the grove.  The spinach pies are also pretty yummy.  This is not a strictly vegetarian place, they do serve chicken and tuna, but its all fresh (at least that's what the food tastes like).  They make great juices and smoothies with all natural ingredients.  It is expensive for a hole in the wall hippie place - a pita sandwich made of hummus and freshly squeezed juice with a vegan brownie for desert cost about $10.  I wouldn't label this posh though because I'm sure the rent is more expensive than the locally grown and raised ingredients."
"3133 Grand Ave, Miami, FL 33133",9/10/2013,$,5,The Last Carrot,This hidden gem has the best fresh vegan/organic food a girl could ask for. It's so good that the line is to the door during lunch hour so make sure you order ahead of time. The girls that work the counter are always so nice & hospitable - they never fail to call me by name. I highly recommend this place to anyone who hasn't tried it! :)
"3133 Grand Ave, Miami, FL 33133",10/1/2013,$,5,The Last Carrot,"I wish there were more places like this in Miami. The menu is simple but always good. Fresh squeezed juices, home made dressings, plentiful veggies, tasty toppings, and homemade vegan dessert. All you have to do is sit at the bar, and order your food, the staff are very nice btw. But you will wait a little if it's lunch time I suggest coming a little before or after the rush, or ordering beforehand if time is crucial for you. Best fresh food around and at a reasonable price. Really, they can't make it easier."
"3133 Grand Ave, Miami, FL 33133",1/9/2012,$,3,The Last Carrot,"Small place, bar counter service and free parking. No matter what ""sandwich"" you get the sauce will make it great. I had the veggie burger and she had a hummus. Everything is served on a very thin pita. So, if you don't like it messy you may wish to order a pie (think empenada here). We showed up 15 minutes before they closed on Sunday evening so they were out of a few fruits for smoothies and the place could use some attention to being clean (bathroom especially). The motto that rang out was ""at least it is vegan"". I just hope all behind the scenes was cleaner than what met the eye but that is rarely the case. ,Vegan cookie was a treat and great. How often do you get a vegan white chocolate macadamia cookie (or was it vegan). Also, it was nice to have a fresh juice though this close to the mall scene.,In short - It was tasty. I just can't truly trust it."
"3133 Grand Ave, Miami, FL 33133",3/11/2015,$,5,The Last Carrot,"Me and my wife love this place! It's a little hole in the wall in the grove, with very friendly service and great food. We usually always get the chicken pita with all the veggies plus avocado & either a smoothie or fresh juice. The best part is getting dessert, they usually have some kind of vegan, organic, gluten-free delicious cake!!!!"
"3133 Grand Ave, Miami, FL 33133",3/30/2014,$,4,The Last Carrot,"A local health/vegan favorite.  VERY ""divey"" and ""hole in the wall"" but that's part of the charm.  Limited menu but what they ave is delicious AND GET PLENTY OF SAUCES (you'll know what I mean after you try them both)."
"3133 Grand Ave, Miami, FL 33133",12/24/2014,$,5,The Last Carrot,"The Last Carrot is a Coconut Grove staple, cherished by Groveites and non-Groveites alike.  I've been coming here for over 25 years, and, though I moved away, I always make it a point to come here to get lunch at least once during my visits back home.  Everything is fresh and tasty. My favorites are the cream cheese and cucumber pita and the chicken or tuna salad melt served in the spinach pie (not the Greek style ones, more like a triangular shaped pita filled with spinach).  They use the spinach pies that are baked fresh at The Daily Bread (soooo good). I always get the green sauce to have with my sandwiches.  I don't know how they make that stuff, but I could put that on anything and everything I eat!  Additionally, they were making fresh, healthy juices way before juicing was cool, and their grasshopper (pineapple with wheatgrass) is delicious. Their vegan desserts are also very good; I, personally, am a big fan of their brownies. The place is family owned and service is always quick and good."
"3133 Grand Ave, Miami, FL 33133",10/7/2014,$,4,The Last Carrot,Awesome vegan place!! If you want a quick juice or healthy snack this is the place to go. I got the special of the day the falafel pita which was amazing and the orange and carrot juice. It was quick easy and decliious. The only thing I didnt like is that they only take credit cards!
"3133 Grand Ave, Miami, FL 33133",8/20/2014,$,4,The Last Carrot,"One of the best vegan spots in Miami with a nice range of Juices, Smoothies, Spinach Pies, Salads, and Sandwiches... All the juices are refreshing - my personal favorite is the Orange-Papaya... Though the smoothie selection isn't as big, they incorporate their seasonal fruits... They have tasty sandwiches, salads, and quiches that come with their original sauces which are a must on any dish. My favorite dish is the Tuna Melt, it's name is fitting since the sandwich literally melts in your mouth! The only critique is that they don't accept credit cards and they close pretty early- definitely a place for lunch rather than dinner."
"3133 Grand Ave, Miami, FL 33133",8/14/2015,$,4,The Last Carrot,"I've been going there for over 20 years and it is STILL one of my favorite places. LOVE the chicken salad in a pita with   green vinaigrette, cheese and tomato spinach pie, fresh apple juice and vegan carrot cake!"
"3133 Grand Ave, Miami, FL 33133",1/27/2014,$,4,The Last Carrot,"I really like the Last Carrot's menu. They offer health food that is actually delicious and filling. Although a simple dish, the Baked Tofu Salad is very flavorful, vegan and pretty filling -- specifically, the baked tofu and the salad dressings are what make the salad so flavorful (ask for both dressings so you can decide which one you like better; I like them both). ,I make a meal out of a salad and a spinach pie. I love the spinach pies! The cheese is deliciously melty and I like how it's not a typical spinach pie because they use a healthy whole wheat pita instead of a fatty flaky crust. ,Aside from the food, the service is a little spotty. I've been here and have been completely ignored or unacknowledged for at least 5-10 minutes before someone said hello and took my order. Other times I've waited less than 5 minutes and the staff seemed pretty pleasant. I guess you'll never know what the service will be like here but at least they make up for it with delicious food!,I'll definitely keep coming back here for the reason that the way I feel after a meal is energized, healthy and satisfied. I'd rather go here for lunch than Chipotle and feel completely stuffed and gross after."
"3133 Grand Ave, Miami, FL 33133",7/15/2016,$,5,The Last Carrot,"This spot has been my favorite for years! Good ol' clean and delicious food. It's always satisfying and friendly on your pocket. It's good for vegans, vegetarians, and meat eaters. I'll forever be faithful to this place."
"3133 Grand Ave, Miami, FL 33133",8/4/2016,$,5,The Last Carrot,"I've been going to this place for years and the food will always be deeelicious.  My favorite is the spinach pie with tomato and avocado.  And don't forget the vinaigrette!  I'm not sure what's in this green sauce but man it's so flavorful and bright.  I could eat the stuff with a spoon it's so good.  Juices and smoothies are also very yummy, and they make an INCREDIBLE vegan chocolate cake. Definitely recommend!"
"3133 Grand Ave, Miami, FL 33133",7/10/2016,$,5,The Last Carrot,"They were super friendly and more than willing to customize my order. Most of the eating area is counter top and definitely was the place to be during lunch hour. Anyone looking for a vegan or vegetarian eatery, this place is absolutely great!! Can't wait to come back again when I'm in Coconut Grove"
"3133 Grand Ave, Miami, FL 33133",2/27/2016,$,5,The Last Carrot,Natural at its finest!  This place isbrefeeshing whether youre a vegan or just want to keep it light.  Had the grosshopper juice which had fresh pineapple and wheat grass shot.  So good. Iwas in the mood for something sweet so I ordered the peanut butter apple and banana PITA.  My daughter had the chicken salad pita that was stuffed with brussel sprouts and veggies delicious.  Everything was refreshing you feel good after you eat here I will definitely be back also prices are low under $10 per person.
"3133 Grand Ave, Miami, FL 33133",7/5/2017,$,5,The Last Carrot,I am a Coconut Grove Native and this is my favorite place to go eat on a regular. The chicken salad pita or the spinach pie with cheese extra crunchy with the tofu they marinate and bake so good. Yum. Then the dressings and the smoothies and the vegan cake..AND the brownies!!
"3133 Grand Ave, Miami, FL 33133",3/19/2017,$,4,The Last Carrot,"Just walking into this place makes you feel like you can live to be 100.  The food and juices are so healthy and fresh.  I had the chicken salad with greens and the beet juice with ginger was extremely delicious and satisfying.  There is a little bit of a wait as the place is small and there are about three staff helping people.  The staff takes your order, prepares your meal and then helps the next group waiting.  It's great because you go get your food promptly after you order, but I think that for general customer satisfaction, if you had some interaction and then waited 10 minutes for your order as a customer you wouldn't feel as anxious.  The food is very good and as I said FRESH.  It's a great healthy alternative and has a lot of vegan options."
"3133 Grand Ave, Miami, FL 33133",1/15/2018,$,4,The Last Carrot,"I've been to The Last Carrot a few times and have always really enjoyed the food.  This is a juice and pita/salad place that serves up really good, really healthy stuff.  There is no table service, you have to order at the counter and bring it back to your seat.  I love the baked tofu.  The green sauce here should be bottled and marketed immediately.  Drink selection is somewhat limited and they do offer lots of natural juices and smoothie type drinks.  Great little vegetarian/vegan/healthy spot in the Grove.  It's homey and friendly but a touch on the loud side when the juicer starts up.  What a great spot for a quick bite that your body will thank you for."
"143 NE 3rd Ave, Miami, FL 33132",1/3/2018,$$,3,Ten Fruits,Ten Fruits has a large selection of vegan salads and other fruit and vegetable forward dishes in addition to the array of smoothies and bowls on offer at the restaurant. I bought a corn salad from the fridge section and it was the perfect balance of acid and spiciness without overpowering any of the ingredients. It made me eager to try other dishes from the shop.
"8530 SW 124th Ave, Miami, FL 33183",4/30/2016,$$,5,MyRoots Juice Bar & Kitchen,"Great concept, delicious food and a nice atmosphere! Friendly, helpful service. My husband and I tried the Wellness Smoothie, avocado toast and lentil bowl. As a traveling vegan, this was a rare find. Love the priority on healthy eating, which is unfortunately way too rare these days. Bravo to these awesome folks and their gamble that some people really do want healthy food, and it looks like it's paying off. Delicious!"
"8530 SW 124th Ave, Miami, FL 33183",9/23/2016,$$,5,MyRoots Juice Bar & Kitchen,"Omg this place is amazing Great to have found an organic juice bar that serves vegan food in the area, the place is beautiful and the best part is it's also drive thru when your on the run"
"8530 SW 124th Ave, Miami, FL 33183",6/8/2016,$$,5,MyRoots Juice Bar & Kitchen,Thank goodness for a wonderful vegan option in the heart of Kendall. Even non-vegans would be happy to eat here! Everything I have ordered has been amazing. I only wish they were open later and would deliver!
"8530 SW 124th Ave, Miami, FL 33183",12/9/2015,$$,5,MyRoots Juice Bar & Kitchen,"Honestly, this was the most delicious smoothie bowl I've ever had. I had the dragon bowl and it is hands down gorgeous. It was delicious and all the fruit was perfectly ripe. It may be $8.50 but it was more than enough to share with my boyfriend. He enjoyed it too. It's nice to see a place like this, where a vegan can go and get something without it being a hassle in Miami. I can't wait to try more of their products. And the owner was sweet and adorable! I hope it does well!"
"8530 SW 124th Ave, Miami, FL 33183",3/22/2016,$$,5,MyRoots Juice Bar & Kitchen,This place is awesome. Juices are fresh and your body will thank you for drinking them. The food is delicious and extremely healthy - tastes like someone made it for you at home. I am not a vegan/vegetarian/health nut by any stretch of the imagination but I look forward to having a chance to stop in.  I would give more than 5 stars if I could.
"8530 SW 124th Ave, Miami, FL 33183",4/14/2016,$$,5,MyRoots Juice Bar & Kitchen,"I'm not vegan but ran into this place and decided to give it a shot. I ordered the Dragon Bowl & Avocado Toast. The Dragon Bowl was amazing! Filling, refreshing & pretty lol! The avocado toast was good too, just too much avocado for me, but this seems like it should actually be a pro."
"8530 SW 124th Ave, Miami, FL 33183",9/28/2016,$$,5,MyRoots Juice Bar & Kitchen,"Even though I'm not a vegan, Roots is still one of my favorite lunch/breakfast go-to places in Miami. So if you're holding back on coming because you aren't vegan either, DONT! They're food is super great for everyone and their Fruit bowls and smoothies are the best thing to have on a hot Miami day. My best friend is vegan so it's nice to have a place near the area we can both go to enjoy. Wish they had more places down here like this one!"
"8530 SW 124th Ave, Miami, FL 33183",1/18/2016,$$,5,MyRoots Juice Bar & Kitchen,"Super fun and friendly staff + absolutely delicious vegan food. The juices are also fantastic, not too sweet, yet aromatic and flavorful. Perfect!"
"8530 SW 124th Ave, Miami, FL 33183",7/16/2016,$$,5,MyRoots Juice Bar & Kitchen,"I have had just about all of their smoothies and they are all amazing! Although I am not vegan, I'm in love with this place. I can only afford to spend 9 bucks on a juice smoothie once every other week, but I have always enjoyed those smoothies up until the last slurp. :)"
"8530 SW 124th Ave, Miami, FL 33183",6/25/2016,$$,5,MyRoots Juice Bar & Kitchen,Great vegan spot! Wish they had one closer to Doral. Drove down to try it after hearing good reviews and was not disappointed. Simple and delicious vegan food and fruit smoothies!
"8530 SW 124th Ave, Miami, FL 33183",6/23/2016,$$,5,MyRoots Juice Bar & Kitchen,The best restaurant in miami. I love the food is very healthy and the smothies are awsome!!! Enjoy the vegan life.
"8530 SW 124th Ave, Miami, FL 33183",11/11/2015,$$,5,MyRoots Juice Bar & Kitchen,"So happy this place opened up! Finally don't have to drive far for a vegan friendly place! Tried one of their cold pressed juices, it was delicious. Can't wait to try their smoothies and snacks!"
