address,date,price,rating,restaurant,text
"3301 NE 1st Ave, Miami, FL 33137",9/3/2017,$$,4,GLAM Vegan,"Went outside my usual food zone to try GLAM Vegan on Saturday evening. I ordered the Gazpacho and Jackfruit Taco ""Al Pastor"" as appetizers, the Farro Risotto as my entree, and an Almond Coconut Truffle for dessert.,Quality,Nothing about my visit to GLAM Vegan changed my attitude towards being an omnivore. However, I was impressed with the creativity that comes with making different food choice selections. With an open-mind I ordered several different items from the menu with varying levels of comfort. I started with the Gazpacho, which was a solid bowl of soup. With chunks of tomato and cucumber, the tomato based soup with cilantro, sherry vinegar, and breadcrumbs was a good start. Next came the Jackfruit Taco ""Al Pastor"" and I must admit I was worried about seeing quotation marks around food items on the menu. The dish was sliced jackfruit in bbq sauce served with pineapple, red cabbage, tomatillo salsa, and tofu cream. It was a unique and tasty combination of flavors that mixed spicy and sweet. Even though it was clearly not shredded pork, the jackfruit provided a good substitute that did not make me miss the meat. The Farro Risotto was not a big stretch from the norm, a mushroom ragout, fennel, white wine, and cashew cream. The farro was cooked perfectly, the mushrooms were very flavorful, and the sauce was excellent. Now I was hoping for a piece of the Ube Pie, but apparently I was too late, so I settled for a Almond Coconut Truffle. It was the only flaw in an otherwise delicious meal. I am not a baker so I don't know what sort of substitutions are needed, but it came out very bland and had a grainy texture.,Quantity,Even though it was just an appetizer the Jackfruit Taco ""Al Pastor"" was still pretty substantial. The Farro Risotto meanwhile was massive and left me stuffed. ,Value,The menu was a bit expensive, but not as bad as I had expected. With so many people around me choosing vegan and vegetarian lifestyles I am used to seeing their bills be nearly double what I order at restaurants. But considering the amount of food and the quality I was okay paying the slightly higher price.,Ambiance,GLAM Vegan is located in Midtown Miami in a row of stores near the newly built apartment complexes. It is set up in a fast casual style that I am not the biggest fan of. After ordering at the inside counter you get a block and wait for the food to come to you. Inside they had about ten small tables and then a dozen or so outside. The restaurant was packed so outside was the only option for me. I grabbed a seat and almost instantly I started getting devoured by bugs and mosquitos. They did have soul music playing over the speakers outside to help the wait go by faster. Inside the store is very modern and sleek. Stylish design with color coordination and a focus on sustainability, as could be expected. The inside area also was very loud and the seats are tightly arranged.,Crowd,On Saturday evening the restaurant was completely packed. People gathered around outside waiting for people to leave their tables so they could scoop in. While it was clear that the restaurant had reached the vegan community, the delicious food also managed to catch the attention of others. I will say the crowd definitely swung towards the younger end and the outside area was a major attraction because many people had brought their dogs with them.,Service,The staff was absolutely great. The girl behind the counter was helpful and the waiters passing around the food were friendly and efficient. They managed to make jokes and stay positive as they darted back and forth from the kitchen.,Parking,I chose to park in one of the garages in Midtown to avoid the hassle of street parking. They also have valets set up nearby.,Extra,With so many vegetarian and vegan focused restaurants popping up across Miami, I decided to finally check one out. GLAM Vegan turned out to be a great choice as the unique and creative take on food has me really intrigued. While I approach it more as a type of food decision rather than a lifestyle or nutritional choice, I appreciate the time and effort it takes to develop these culinary creations."
"3301 NE 1st Ave, Miami, FL 33137",6/10/2018,$$,5,GLAM Vegan,Wow! Can I say this place lived up to it's reviews completely!!! I went here for my birthday with a group of 10 people. Half are vegan and the other are not but we're completely willing to try it. We literally made our dishes into tapas trying each other's food and everything was extremely tasty. From the spicy buffalo cauliflower to the watermelon ceviche to the vegan burger my party was totally blown away and had an open mind to try more. We kept on ordering more food because the non vegans loved it so we also tried the risotto mushroom and the spaghetti and meatballs. So good. Props to the owner and the staff. Very welcoming and accommodating! I would definitely come again.
"3301 NE 1st Ave, Miami, FL 33137",3/22/2018,$$,5,GLAM Vegan,"This place is incredible! My girlfriend and I shared some Tacos, Spaghetti & Meatballs, and the BBQ Burger! Washed it down with some Pomegranate Kombucha, and finished the meal with some Teuffles. Everything was Vegan, Gluten Free, & DELICIOUS!!!"
"3301 NE 1st Ave, Miami, FL 33137",8/24/2017,$$,5,GLAM Vegan,"I went here with my girlfriend for a random lunch date because we've heard nothing but good things about this vegan spot. It didn't disappoint. For a while we've been wanting to check this restaurant out. Appearance was great, the server was very attentive, and food was so good. Just the right amount served to satisfy us without getting too full. We had roasted mushroom flatbread to share, a lean a green cold noodle dish, and i had a bit of my girlfriend's gazpacho. After that, it was time for dessert! Out of the 2 desserts ordered, my favorite was the matcha tea custard. The other dish we ordered was the ube pie, made from sweet potato. It was delicious as well. Next time i want to try the truffles! ,There's so many options for food here i can't wait to try them all"
"3301 NE 1st Ave, Miami, FL 33137",8/1/2017,$$,5,GLAM Vegan,"Another great spot to get your plant based meals! Vegan spots are starting to pop up all over and Glam is a small intimate quick service restaurant that does it very well! The presentations are beautiful and all served on elegant black plates. We had the avocado toast, the risotto, and the ""sausage"" flatbread!  All were excellent! My favorite was the flatbread and the cauliflower imitated the taste of sausage very well! ,The service is great and the entire staff was super friendly and welcoming. They have golden utensils that really pop against the black plates. Great for those instagram pics! ;) They also have a bunch of truffles right at the register that are ginormous and tempting! Smart tactic!  But this time for dessert, we had the matcha pots de creme! Soooo good! If you like creamy matcha, this is a must!"
"3301 NE 1st Ave, Miami, FL 33137",3/11/2018,$$,5,GLAM Vegan,"I could eat here almost everyday if I lived in the area. Vegan food thats yummy and the portions are great. I ordered 2 flat breads. 1 was the pear and the other was ""sausage"". My friend and I split them and they were simply delicious. The decor was casual with a drop of elegance on both the inside and out. I also got the mango apricot tea which comes unsweetened but they will provide you with a side of agave syrup. I was so impressed honestly. I had no idea that I would enjoy eating Vegan food so much but I've been looking for a reason to come into Midtown for lunch for months now and what better time to do it than now. I think next I want to try the spaghetti. At some point I'm planning on making my way through the entire menu. If you want some modern Vegan food that's flavored to perfection please check them out!!"
"3301 NE 1st Ave, Miami, FL 33137",9/20/2017,$$,5,GLAM Vegan,"I'm not on the all vegan wagon yet but I do occasionally enjoy a plant-based meal. Vegan restaurants are starting to pop up all over Miami but not all are that good, this one here is one of the very few good ones. Came by today and had the daily soup to start and that is the Tuscan white bean and kale soup which was very delicious. The soup has depth and a creamy consistency that I enjoyed very much and the kale goes perfect with it. ,     Then I went for the spaghetti and meatless balls and that was also very good, to my surprise. The grain bean balls are crunchy on the outside and very flavorful, enough to forget that you are not actually eating meatballs, especially for those in the transition to becoming all vegan, not moi. The noodles were perfectly cooked and the marinara sauce was amazing enough to have without any Parmesan cheese which is a must for me when eating pasta.,     The place looks super clean and organized and they have a station with utensils, glasses, napkins and water...self serve. The service is good considering they only bring food out from the kitchen and pick up anything on the table. I'd love to try the Gaspacho next time because from the photos I've seen, it looks delicious."
"3301 NE 1st Ave, Miami, FL 33137",8/30/2017,$$,5,GLAM Vegan,"The best VEGAN restaurant in Miami. The food at this place is AMAZING. Also they offer you free water and sparkling water. Prices are very good in compare to other overpriced fancy vegan restaurants. ,If you are a true vegan you will love this place and if you are not a vegan but like to eat clean you will be very surprise by this place. A+"
"3301 NE 1st Ave, Miami, FL 33137",8/5/2018,$$,5,GLAM Vegan,"My best friend and I came here for her birthday and must day I was pleasantly impressed. The place is cute and like the name said ""glam"". Loved the decor but I loved the food even more. Every dish that we had was amazing. The price point was great. I would recommend this to all the vegan divas and divos with excellent taste in food."
"3301 NE 1st Ave, Miami, FL 33137",5/7/2018,$$,5,GLAM Vegan,"Recently been trying to transition from a Vegetarian to Vegan phase, my friends recommended this place and I loved the modern look and feel. Personally sitting outside is better on a nice night. Food was great and different. ,Recommend the BBQ burger."
"3301 NE 1st Ave, Miami, FL 33137",11/15/2017,$$,5,GLAM Vegan,"Living in Broward has its disadvantages...it doesn't have GLAM!  My friend surprised me with a girls day out for lunch.  She is not Vegan, but she is so supportive and doesn't want me stuck eating a salad and french fries for lunch...so she brought me to Green Living Animals Matter (GLAM).,We walked in and the girl behind the counter was super nice.  She let us know immediately they had some kitchen issues so we were unable to get the jack-fruit tacos or the bisque.  No worries, there was plenty to eat.,Food:  My friend and I shared everything.  We started with the Mushroom Risotto.  YOU MUST have this!  It was amazing.  We also had the pear flatbread.  It was probably my favorite of everything we ate.  It had pears, cashew ""ricotta,"" and red onions with a pesto sauce.  It was absolutely delicious.  The Miso Avocado Toast was tasty, but hey everyone can make an avocado toast.  We also had the white bean hummus..not my favorite.  The tahini seemed over powering.  The hummus came with a homemade cracker made from sesame seeds, chia seeds, flax seeds and pumpkin seeds.  AWESOME!  We also had some lattes made with toasted coconut almond milk.  DELISH!,The restaurant is pretty much self service.  You order at the register, get a number and the team brings it to you.  They also have self service water.  You can get sparkling water, flat water or effervescent water.  The silverware is gold and there are no paper napkins.  The seating inside is limited, but they have outside seating as well.  ,Everyone, including the other patrons, were super friendly.  Customers were willing to make suggestions on what to eat.  ,It was nice to go out for a vegan meal that wasn't filled with tofu and salad.  The food was innovative and delicious.  I wish they were closer to my home, as I'd be there daily!"
"3301 NE 1st Ave, Miami, FL 33137",7/9/2018,$$,5,GLAM Vegan,Found Glam on yelp while looking for vegan restaurants while staying in Wynwood. We enjoyed the mushroom risotto & nachos. I definitely recommend this place.
"3301 NE 1st Ave, Miami, FL 33137",10/5/2017,$$,4,GLAM Vegan,"Was in the mood for some vegan food so I stopped by for lunch. ,I ordered the jackfruit taco ""al pastor"" with bbq jackfruit, pineapple, red cabbage,tomatillo salsa, tofu cream and the Lean and green bowl - zucchini noodles, chunky avocado, snow peas, asparagus, broccolini, lemon-basil pesto. ,The jack fruit tacos were extremely delicious and definitely my favorite. Was really impressed how the jackfruit had so much flavor and texture and consistency was like a shredded beef. It has a nice spicy kick to it. Wow! However they are quite pricey. At $7 a piece I could have had 4-5. Do the math $28 for 4 tacos it can get quite pricey. Ouch! ,The zoodle bowl was good, honestly nothing special. I Was expecting the pesto sauce to have that strong savory herbal flavor, it didn't. ,Overall very nice spot, can't wait to try the other dishes."
"3301 NE 1st Ave, Miami, FL 33137",10/12/2017,$$,4,GLAM Vegan,"I love the concept of GLAM vegan. I've heard so many great things about it that I finally decided to give it a try for myself. The restaurant is very chic, the staff are friendly, and the food is good. ,At the register, they offer samples of their soup of the day. While, I can't remember exactly what sample I had, I wasn't very impressed. The soup was very thick but that was from the excessive amount of flour used to create the consistency. Overall, it lacked flavor and was very bland. Although, I ordered the Mushroom Risotto which was surprisingly pleasant. The risotto was very creamy, flavorful, and filling! ,There are some other items on the menu that I would love to try, so I'll definitely be coming back."
"3301 NE 1st Ave, Miami, FL 33137",7/2/2018,$$,5,GLAM Vegan,"Loved it here! The mushroom bisque was delicious and I thoroughly enjoyed the Hawaiian poke bowl. It was surprisingly close to real poke! Our server was super good looking (please take my number if you're reading this) and very helpful, answered a lot of my companion's questions. They also put the ricotta on the side of his spaghetti upon request which was very nice and considerate. My companion is not vegan and I am, so he wasn't a big fan of the seitan meatballs but I'd run that up to personal taste and not preparation, I thought it was amazing! I loved the vibe there, it was very Miami while still being a bit romantic and classic. I'm hoping to return before leaving the city, absolutely loved it!"
"3301 NE 1st Ave, Miami, FL 33137",3/6/2018,$$,5,GLAM Vegan,"OMG.. If there were 50 Stars, GLAM Vegan would get all of them!!  3 times over!! ,This little place is so magically delicious!  So much so, I went twice during the same weekend I was down to visit. ,There is a delicious menu with appetizers, main meals and desserts as well as wine!  It doesn't get any better than that.  They even have a cool water machine where you can pick your own water type and fill up a bottle to take to your table.  Still, sparkling, cold or ambient water.. SO COOL!,You walk in and you place your order at the main counter.  You then get an oversized what looks like a Scrabble tile with a number on it to place on your table so they know where to bring your goodies!  ,As I enjoy my dessert first (why wouldn't you - what if something happened to you before your actual meal came?!  Wouldn't you have liked to have began with the sweetest thing??) and it was a Tres Leches yumminess that I wish was bigger! The cake was soft and moist and was topped off with a dollop of this whipped cream that you couldn't tell me was not dairy!  Nom Nom Nommy Nom Nom!  ,Then it was on to the spaghetti and ""meat"" balls.  SO. GOOD!!! Again.. you couldn't tell me they didn't sneak beef up in them meatballs.  The noodles were cooked to al dente perfection and the sauce was seasoned by angels.  So delicious!!,The service was spectacular.  Everyone was kind and sweet and GLAM is now one of my Miami must go to eat places whenever I'm down there.  Whether you are vegan or not.. treat yourself and everyone with you to some yummy good food that is also good FOR you too!!  Thank you, GLAM, for BEING!"
"3301 NE 1st Ave, Miami, FL 33137",6/28/2018,$$,5,GLAM Vegan,"Glam vegan is definitely a must try vegan spot, it's hard to choose a fave but their ceviche was out standing"
"3301 NE 1st Ave, Miami, FL 33137",8/8/2017,$$,5,GLAM Vegan,"Glam Vegan definitely lives up to its name. I kind of feel like the vegan food genre gets a horrible rep for itself in that the food has to be boring, the places are decorated blah and nothing is never ever really good. This is totally not the case here!,Located in Midtown, it's got a cute little vibe to it. Has very modern and sophisticated decor, I really loved the gold silverware. Was definitely a nice touch. Water is self serve and the process is simple, you go to the counter, order, they give you a number and bam! You have your food a little later.,My first dish was the watermelon poke which was a great play on tuna poke. Totally admitting, it didn't taste like tuna, the textures of the watermelon gave it a nice bite. I love the lotus and yuzu vinaigrette too. Nice mix of sweet, a little tart.,My meal was the farm salad bowl which I was really nervous about since it was my meal. It was huge, delicious and so much better than I could ever imagine? Who knew cashew ranch could be so delicious!? I could have done without the green beans, but thank god there was avocado! Everything was fresh and delicious, I honestly couldn't ask for more.,Meal came to $21 which overall I don't consider bad for being in Miami and being a speciality type of restaurant. I highly recommend Glam if you're looking for something different, something healthy, and just plain good (for you)."
"3301 NE 1st Ave, Miami, FL 33137",7/21/2018,$$,5,GLAM Vegan,"This place is a Gem. The nachos were great. Also, had the buffalo cauliflower bowl. My parents who aren't vegan were pleasantly surprised. I highly recommend this place!"
"3301 NE 1st Ave, Miami, FL 33137",8/3/2018,$$,5,GLAM Vegan,"This was actually our first visit to Glam, but now it definitely became our favorite place in town. As vegans, it is always hard to find a place where we can find veganlicious food, with kid friendly options. The place was clean, charmingly decorated, neat, and very relaxing. The staff was very receptive and kind. My husband had a BBQ Burger, the kids had Nachos to share, and I had a Chana Masala Hot Bowl. Don't forget to have dessert, they all look delicious, we went with the Ube Pie...and O.M.G, I can not describe how delightful it was!,So, I absolutely recommend this place!,Can't wait to come back! ,@harmannylife"
"3301 NE 1st Ave, Miami, FL 33137",7/21/2018,$$,5,GLAM Vegan,"We have been into our fair share of vegan restaurants in the Washington DC area but this is the best that we have been to untill now. ,Located in midtown miami district,  this place has a cool interior decor (limited indoor seating area). We order their daily soup- gazpacho which was cold but did not lack in flavor  - something that can be said about every dish we had! We tried the mushroom bisque,  mushroom flatbread and farro Risotto topped with shrooms (guess what we are into these days!) ,They have Vero water dispenser which has sparkling water as well. Something new that we haven't seen anywhere else.,Overall, this place is pretty unique, entirely vegan and everyone should definitely try it once when in Miami. We are definitely coming back to Glam Vegan the next tine we are in town!"
"3301 NE 1st Ave, Miami, FL 33137",7/2/2018,$$,4,GLAM Vegan,"For those who want to explore vegan cuisine, this place is just for you! Located in the up and coming Miami Midtown area, this restaurant serves creative vegan food that truly is delicious, regardless if it was vegan or not. This restaurant is an order and then sit down type of restaurant, which makes it pretty causal and straight forward. Parking availability includes street parking and garage parking, although the latter is more convenient.,Now on to the food: if you think vegan food could not be tasty, this place will prove you wrong! My party ordered a variety of things, my favorites being the Hawaiian poke salad and the pear flatbread! So many great flavors, all of which were very good at substituting what you would think would normally contain meat, like the Jackfruit Tacos and the BBQ burger (which had too much BBQ sauce in my opinion, but of course that is just preference). I also like that there was somewhat a South East Asian flair in their dishes, many of which used ingredients from that area of the world. For dessert, my BF and I took some Ube pie home, as we love Ube (a purple yam that is a staple in Filipino dishes)! However, it did not have the Ube flavor we were looking for, and tasted like the typical sweet potato pie you eat on Thanksgiving, so unfortunately it did not wow us.,Last few things about this place, price range for each dish is from $7 - $20, and prepare to get several dishes since the majority of them are tapas style. Interior design is neat and clean, but there isn't as much seating inside as outside. Service is great too, very friendly staff! Other than that, I'd say if you ever want to dine vegan, then this is the place to visit!"
"3301 NE 1st Ave, Miami, FL 33137",6/1/2018,$$,5,GLAM Vegan,"Delicious vegan food! So happy to have stumbled across this place. I haven't been to many vegan spots yet, but i had a great experience at Glam. The watermelon ceviche was my favorite. The spaghetti + meatless balls and farro risotto were also really good. Definitely stopping by again to try a few other dishes :), -,Edit: since my review I've been back a few times and tried the Verde flatbread, Nachos, vanilla almond French toast and the Ube pie (purple sweet potato) - all very delicious"
"3301 NE 1st Ave, Miami, FL 33137",7/4/2018,$$,5,GLAM Vegan,"Searched yelp for a great vegan place to dine this past weekend. Came across GLAM vegan. ,After seeing the photo of the pear flatbread it was love at first sight! ,A quick service type of place. Seating inside & out. Adorable cart near the front door with self-serve glasses, bottles for ""water pitchers"", flat water, sparkling water, & gold utensils! It added a nice touch.,At the counter they have a little display case filled with sweets! Pie, cookies & truffles.,The young lady handed us a brunch menu but I was all about those hot entrees! Side note the girls that sat next to us ordered the French toast! Not only did I want to photograph her food, but I wanted to stick my fork in & grab a piece!! It looked scrumptious!!,We ordered pear flatbread, veggie burger with slaw & spaghetti with meatless meatballs. I wasn't going to order a drink but since the sangria sounded so enticing I ordered a glass.  Sangria was a blend of sake, rose', pear & pineapple. I don't mind paying $9 a glass but I did ask if it was a decent size.... to my surprise when it came out it looked like a little shot in my huge glass! ,My husband & I looked at each other & smiled....,When we make sangria or usually get it it's a tall glass! In any case it was delicious. Just wish it was at least half way filled for $9.00. I wouldn't order that again....,Spaghetti dish was out of this world delicious! Portion was perfect. Plated beautifully I would 100% order this over & over! My husbands veggie burger was fantastic! Daughters flat bread was so unique! Every bit of wonderful! When you love & appreciate good food & stumble upon something wonderful you want to make sure people really know about it!!! ,Staff was so attentive & friendly! All smiles! ,We had an amazing experience They even sampled their daily soup which was black bean. Each day they feature a different soup. I really wanted to try a dessert but I was too stuffed lol,Highly recommend this place for everyone not just vegans! ,I came away with one question! When I return do I get what was so absolutely perfect or venture off and try something new ;-)~"
"3301 NE 1st Ave, Miami, FL 33137",4/24/2018,$$,5,GLAM Vegan,"Pretty impressed with Glam. I have to say it's one of our new favorites in the vegan food world. The spaghetti is phenomenal and I was surprised the serving size was pretty substantial which was a definite plus. Not sure what the ""meat""balls are made of but whatever it was- more of that please. We also tried the tres leches and I was surprised to say I think I like it more than it's original dairy sibling. The ube pie is pretty glam for the 'gram and taste nice too by the way. ,Everything that we have tried has been exceptional and definitely has not lacked in flavor. Looking forward to soon returning and trying out the BBQ burger and the risotto!"
"3301 NE 1st Ave, Miami, FL 33137",7/9/2018,$$,5,GLAM Vegan,"FIRE. I had the pesto pear pizza OMG AMAZING. also the tres leches??!?!? HEAVENLY. This place is high on my list of best vegan spots in Miami. ,My friends got the bbq burger I believe and the chickpea masala or something? The Indian dish was great but I personally didn't care much for the bbq burger"
