address,date,price,rating,restaurant,text
"8530 SW 124th Ave, Miami, FL 33183",2/28/2018,$$,4,MyRoots Juice Bar & Kitchen,Quality quality quality!!!! This is one of the very few all natural all organic all vegan places in Kendall. It's easy to tell it's in high demand because they always have a line out the door! I always order ahead but there food and smoothies are amazing and definitely worth the money! Feels like you're doing your body good! Get more locations!!! Or a bigger space!
"8530 SW 124th Ave, Miami, FL 33183",1/18/2017,$$,5,MyRoots Juice Bar & Kitchen,Transitioning to a vegan lifestyle can seem quite daunting and complicated. For me it's about making one change at a time and not all at once. This vegan friendly restaurant is my go-to the days I don't feel creative in the kitchen or right out have no clue what I'm going to cook that day. It's a 20 minute drive from my home but well worth it. There are no words to describe how good everything on the menu is and I mean everything!! My favorites are the Dragon Bowl for breakfast and Zoodles Bowl for lunch. If you want to feel brand new eat @ Roots. Your body will definitely thank you!
"8530 SW 124th Ave, Miami, FL 33183",7/10/2016,$$,5,MyRoots Juice Bar & Kitchen,"Love this vegan juice bar/ cafe. They have great options are different types of juice and healthy snack juices like acai bowl, dragon bowl, quinoa bowl and avocado toast. Not only the food is delicious, people are friendly, it's a perfect Instagram spot as well. ;),I tried the dragon bowl, it's huge and sosososo good! I didn't expect a layer of granola at the bottom too. Love it! The granola is no generic, full of flavor and various seeds. ,Will come back to try other stuff for sure!"
"8530 SW 124th Ave, Miami, FL 33183",3/25/2018,$$,5,MyRoots Juice Bar & Kitchen,"I love roots juice bar, it's one of my favorite places to eat usually on Sunday's for lunch (They changed their times and they're opened every day now which is a plus!).I usually get the lentil bowl, and it comes with brown rice and a side of veggies. I have tried most of their food bowls on their menu, and all of them are delicious! Their vegan chocolate cake is amazing! Also, they do have signs by the register that states that food may take up to 20 mins just because their food is served fresh, so there is a bit of a wait but it's worth it."
"8530 SW 124th Ave, Miami, FL 33183",12/8/2017,$$,5,MyRoots Juice Bar & Kitchen,Excellent vegan place!! The food is great and very healthy. The avocado toast is amazing and every dish is fresh and delicious. I wish there are more Roots locations. A must!
"8530 SW 124th Ave, Miami, FL 33183",1/4/2017,$$,5,MyRoots Juice Bar & Kitchen,"I received an add from Yelp, telling me about healthy eating places near me, so I decided to give this place a try, I'm not really a vegan but really enjoy healthy foods. Wanting to give his local place a try I ordered a few things, Dragon bowl... delicious, Morning Bagel... WOW, Lentil bowl....double WOW, I also decided to try the Avocado Toast because all the reviews ranted about it, I think it was too salty, a little less salty & I think it will be great. Overall the food was a total success, I will definitely be coming back to try some more items from their menu"
"8530 SW 124th Ave, Miami, FL 33183",1/16/2017,$$,5,MyRoots Juice Bar & Kitchen,"I came out to Miami during my sister's best friend's wedding. This place happened to be next to the hotel we were staying at, so I decided why not give this place a try? This is a raw vegan restaurant and juice bar, although they cook their food. For my meal I had the zucchini noodles with vegan Bolognese and a green soup. I really enjoyed the zucchini pasta (zoodles) because they really fill you up and trick your brain into thinking your eating spaghetti. The Vegan Bolognese was very thick and chunky in consistency like its traditional meat counterpart. My green soup was very well seasoned and I could appreciate the distinct taste of broccoli in it. The staff here are incredibly friendly. The day I came in, the place was packed with a line out the door and despite this the nice girl at the counter stopped what she was doing for a moment and gave me a knife when I asked for one. I don't go to Miami very much, but if I do, I will be sure to stop by here again to try more of their items!"
"8530 SW 124th Ave, Miami, FL 33183",9/27/2017,$$,5,MyRoots Juice Bar & Kitchen,"I have been hesitant to try this place due to the location being in a very heavy traffic area. Recently I stopped by for the first time and I was really impressed with the place. I ordered a dragon fruit smoothie, a bagel with vegan cream cheese and a vegetable soup and everything was delicious. Making a healthy vegetable soup is hard to do and they do it so well. I love that they use organic ingredients and environmentally friendly to go packaging. This is a great spot if you're looking for a healthy or organic option."
"8530 SW 124th Ave, Miami, FL 33183",10/5/2017,$$,5,MyRoots Juice Bar & Kitchen,"One of my favorite vegan spots in south miami. My favorite is the bean bowl and zucchini pasta. Not once have I been disappointed when I go to this place. Everything from the juice, smoothies, food and dessert never disappoints. Very attentive staff."
"8530 SW 124th Ave, Miami, FL 33183",7/9/2016,$$,5,MyRoots Juice Bar & Kitchen,"Amazing service . Staff had excellent knowledge of everything and let us try different fruit because adding it in the smoothie. This is a hole in the wall because I would've never noticed if it was for a friend who recently went from vegetarian to vegan and wanted to try this from Yelp reviews. ,It's very peaceful and quiet. Parking says 1 hour only."
"8530 SW 124th Ave, Miami, FL 33183",2/13/2018,$$,5,MyRoots Juice Bar & Kitchen,"Great Vegan Friendly options. Very clean and friendly staff.  Food was really tasty. I recommend the Quinua Bowl, the Bean Bowl, and the Açaí bowl."
"8530 SW 124th Ave, Miami, FL 33183",1/5/2018,$$,5,MyRoots Juice Bar & Kitchen,Super fresh and tasty. Made me feel more alive when I ate this food. Great variety and high quality food. Definitely one of the best vegan/vegetarian spots in this area. Wish that there was more space to sit inside.
"8530 SW 124th Ave, Miami, FL 33183",12/26/2017,$$,5,MyRoots Juice Bar & Kitchen,The customer service and cleanliness of this place is impeccable. Loved its all plant-based menu. It's a must-go for vegans and vegetarians in the Kendall area.
"8530 SW 124th Ave, Miami, FL 33183",7/19/2016,$$,4,MyRoots Juice Bar & Kitchen,"A solid 4.5 stars...This juice bar is exactly what West Kendall needed. Its fast, delicious, convenient, and vegan. It's tucked away in a shopping center behind a hotel so it's hard to find. But no worries, plug it in your GPS and it takes you right there. The staff is friendly and accommodating. Very simple and inviting décor. They have an array of juices and smoothies. Their food menu is small but definitely not lacking in flavor. All the menu items are plant based and for the most part organic. ,I tried: ,Avocado toast: The flavor was delicious. I just wish the avocado had thicker chunks and not have so much of a creamy consistency. The addition of the chia seeds were exceptional and gave it the final touch. ,Vegetable soup: Once again amazing flavor but I felt all I got were blended vegetables. I like when there is heartiness in my soup and I can actually crunch on a vegetable or two. ,Dragonfruit Acai Bowl: O.M.G! Best bowl I have ever had! Hands down. The toppings were so delicious. Banana, strawberry, kiwi, blueberries, coconut chips, granola, and chia seeds decorated the bowl beautifully and sat on top of the perfectly blended dragon fruit. Its a must order. ,and last but not least....The wonderful Lentil Bowl: I loved this so much. The lentils were so so so good! I tip my hat off to the wonderful person who seasoned this dish so beautifully. This bowl comes with a heeping serving of lentils, brown rice, and grilled vegetables. Perfect for lunch or dinner. Portions were the perfect size. ,I will definitely be coming back to this location. I know for sure I will be ordering The dragonfruit bowl and the Lentil Bowl. Two delicious concoctions that are worth trying! ,Cannot wait to try their juices. ,P.S. parking can be a bit of a pain. Don't fret, when you drive into the small plaza there is more parking if you keep driving straight."
"8530 SW 124th Ave, Miami, FL 33183",12/4/2017,$$,5,MyRoots Juice Bar & Kitchen,"I love this place! I am excited to find places like this (Vegan/Vegetarian options!) in Miami / Kendall area! The atmosphere is very nice, have many options on their menu. I had the Quinoa bowl and Love potion (beet, pineapple, pear, ginger, chia) juice!"
"8530 SW 124th Ave, Miami, FL 33183",7/12/2016,$$,5,MyRoots Juice Bar & Kitchen,"So i'm not vegan or even health-conscious over my food, but after having a friend talk my ear off about how much she was craving an acai bowl, i decided i must try one for myself. ,Roots is not at all on my way. I happened to be in the area and Yelp recommended them when i searched for a local Juice Bar. ,Let me tell you, i am so glad i stopped in here. The atmosphere is adorable: trendy white couch, stool seating along the windows, and a communal picnic table with an artificial tree sprouting in the middle. There's open cooler with fresh beds of wheatgrass, their pressed and bottled juices, and other assorted drinks. The kitchen is partially visible from the register so you can see most goings-on with your food. Their menu can be found on clipboards all around the shop so ordering is more expedient. ,I ordered the Acai Bowl and their Lentil Bowl. Immediately, the young woman said I made good choices but that it would be a lot of food if it was all just for me. I absolutely loved that. I let her know that I was planning on eating the Lentil Bowl later in the day, and asked if it would keep until then. She rang me up and said she'd fulfill the acai bowl order first and whenever i felt it was a good time to go, she'd fulfill the lentil bowl order so i could leave with the freshest food.,The Acai Bowl was the first i've ever had, and i may have ruined myself for any other. Their portions are large and filling; their toppings are liberal and a real treat. The bowl had a multitude of toppings, but also the bottom of the bowl had a generous layer of granola and chia seeds. It was definitely my happiest food experience in 2016. Every spoonful was savored and by the time i was near finished, a gentlemen had dropped off a warm brown bag with my lentil bowl. ,So in the end, I've been trying to give myself an excuse to get back into this area and stop by Roots again. 5/5 in everything: quality, service, value. No other bowls have met my standards."
"8530 SW 124th Ave, Miami, FL 33183",11/4/2017,$$,4,MyRoots Juice Bar & Kitchen,So far I have been here twice and each time I really did enjoy it. The first time around I ordered a smoothie and the avocado toast. My husband and I really enjoyed both. The second time around we did have one of their bowls which was pretty tasty. I do like the vibe in there. It can be a little to warm in there though. I definitely plan on going back again. It is a great healthy option regardless if you are vegan or vegetarian or not.
"8530 SW 124th Ave, Miami, FL 33183",12/15/2017,$$,5,MyRoots Juice Bar & Kitchen,"I am not even vegan or a daily healthy eater and I loved everything from the juices, the food and the deserts. 100%recommended."
"8530 SW 124th Ave, Miami, FL 33183",12/15/2017,$$,4,MyRoots Juice Bar & Kitchen,"Best vegan/healthy food in town. I am not even vegan or a daily healthy eater and I loved everything from the juices, the food and the deserts."
"8530 SW 124th Ave, Miami, FL 33183",5/24/2017,$$,5,MyRoots Juice Bar & Kitchen,"Incredible. Shared the fajita bowl (without the spicy peppers), avocado toast, and a butternut squash soup and it was AMAZING! Even my non-vegan family member thoroughly enjoyed it. Can't wait to go back.,Also, the presentation was so cute! I'm just digging everything about it."
"8530 SW 124th Ave, Miami, FL 33183",1/20/2017,$$,4,MyRoots Juice Bar & Kitchen,"Such a cute little juice bar! I live in the area but only recently heard about it. When I heard there was an a vegan all plant-based foodie heaven near me I was all about it. I didn't want to get my hopes up as far as taste because I feel I am really picky. I ordered the lentil bowl and was pleasantly surprised about how good it was. The lentil bowl comes with brown rice, broccoli, zucchini and carrots - can't complain. I'll be back to try juice and breakfast bagel."
"8530 SW 124th Ave, Miami, FL 33183",8/15/2017,$$,3,MyRoots Juice Bar & Kitchen,"I have been working on going vegan for some time now and the food here is AMAZING! I am a fan of the dragon fruit bowl, coffee, and fajita bowl! They are expensive but most health food places are so it is expected. ,I have to take out two stars, not because of the food (which I encourage everyone to go try), but because of the customer service. I have realized they are becoming more popular and now are much more frantic, making more mistakes and, even making rude comments at times.  Many times, when I call in to place an order to avoid waiting in the crowded little seating area, they don't pick up. I recently mentioned this to one of the employees (I think he could have been the manager, but I am not sure), and he told me ""I can't do 5 things at once!"" I think they lack a little bit of professionalism, but it's still great food in a convenient area close to where I live. so mehhhh..."
"8530 SW 124th Ave, Miami, FL 33183",8/21/2017,$$,4,MyRoots Juice Bar & Kitchen,This place is right by school and it's pretty great. It is only vegan so they do not have many options although I love vegan foods. I got a avocado/kale salad of some sort with a spicy sauce. That was delicious! Downside part of this place is the wait and how busy it gets! A tip would probably be to open up earlier
"8530 SW 124th Ave, Miami, FL 33183",7/12/2017,$$,5,MyRoots Juice Bar & Kitchen,"Ok, so I had not tried an Acai bowl because as most things are now in days I thought it was a fad hipster dish. I thought it's a smoothie in a bowl how great can that be...OMG WAS I WRONG. Yes, to some people it's still a fad to go vegan because that is the cool thing now in days, I'm not vegan but I do have a plant based diet day a week. The acai bowl is toooo die for. I can die and go to heaven now, so so so good! I don't even have words to describe the perfection that the acai bowl is. I'm going to try the avocado toast next time I come here."
"8530 SW 124th Ave, Miami, FL 33183",1/8/2018,$$,5,MyRoots Juice Bar & Kitchen,"Please visit this place whether you're vegan/vegetarian or not, you will fall in love with the food, açaí bowls as well as the cozy, coffee shop ambience. Try the frijoles bowl and the avocado toast."
"8530 SW 124th Ave, Miami, FL 33183",5/8/2018,$$,5,MyRoots Juice Bar & Kitchen,Super good Vegan place in West Kendall. Try the bowls and the juices. The avocado toast is super delicious as well. #savetheanimals
"8530 SW 124th Ave, Miami, FL 33183",2/28/2017,$$,5,MyRoots Juice Bar & Kitchen,"This place is pretty awesome. Their menu ranges from options of lentil soups, to sandwiches, salads, juices, energy bowls, and anything in between. It's a vegan's heaven. It is a bit pricey, but that expected at most of these health and ethically conscious restaurants. I still have a ton of meals to try out on their menu, and so far I've loved their lentils, dragon bowls, avocado toast, juices, smoothies, and a few other options-basically everything has been great thus far. ,I like to come here often, usually whenever I'm in the Kendall area. Whenever I bike or drive out to the Kendall Regal Village, I like to grab a bite to eat here if I'm hungry, especially if I have just finished a workout at the LA Fitness, or finished a film at the theater, or finished picking up art supplies at Michael's, or have been spending my afternoon at Barnes & Nobles. Honestly this little mall plaza has just about everything I love, and it's my own personal escape on Kendall Drive. So the location of this vegan restaurant just makes it that much better. I used to come here a lot more back when I worked in the area, but I still come here often enough because of my gym membership and the other stores. I'm surprised it took so long for me to write a review. ,Parking is free and it's a private lot. There's also bike parking, so it's perfect. And free wifi! So between here and the Barnes & Nobles, it's a great location to study or read if you want to get a change of scenery from the library or your house. ,The staff is friendly and I enjoy their service. No complaints. You do get 20% off of your purchase on check-in, so keep that handy! ,I can't wait to bring my boyfriend here, as I've been trying to introduce him to more vegan options and vegan restaurants. It's difficult to convince him because he eats meat and is stubborn, but when I come with him I will recommend he gets one of their higher calorie/higher protein options, since that's his main hesitation to vegan food-he thinks it's not enough calories or protein for the price, especially for someone like him who is trying to gain weight. *sigh* There are plenty of options for everyone, even for those who work out and are looking for plant based protein.  ,Overall it's a great experience, tasty and healthy vegan food, great location and convenience of being right off Kendall Drive, and free bike and car parking. Did I mention how that is so perfect? They take card and cash, too. I only wish they stayed open later."
"8530 SW 124th Ave, Miami, FL 33183",2/9/2017,$$,4,MyRoots Juice Bar & Kitchen,"I yelped ""salads"" and this place popped up. On the drive there, I was excited to have found a place like this in Kendall (when I think juice bar and vegan, I think Miami Beach). The cashier was kind and made a suggestion for my order. I am always happy to hear suggestions, especially when it's my first time. I ordered a caramel macchiato (with almond milk--as per her recommendation) and it was delicious! Not bitter, not overly sweet. I also ordered an avocado toast--light yet satisfying. I tend to go overboard with new things so I fully intend to go back tomorrow to try a smoothie! ,My one complaint is how tiny the space is! There isn't much space to wait for your meal if it's to go. If you choose to dine-in, the seating is very VERY limited. Granted, this was lunch time so I completely understand. I will return during non-peak hours."
"8530 SW 124th Ave, Miami, FL 33183",6/5/2018,$$,5,MyRoots Juice Bar & Kitchen,"Being a vegan, I can tell you this place is a great spot! They have delicious food bowls, my favorite being the Dragon bowl! They also have several other lunch items that are extremely tasty and fresh, I would definitely recommend the zoodles and avocado toast... their desserts are also amazing, most of them are vegan and again, very very tasty! I have tried several of their smoothies and they are also very fresh, made to order, and absolutely delicious!"
"8530 SW 124th Ave, Miami, FL 33183",6/12/2018,$$,5,MyRoots Juice Bar & Kitchen,"This place is Vegan but you don't need to be Vegan to eat here! This place's menu is EXTREMELY good. I have been there more than 12 times this year alone (it's a little far from my house but if i could go more I would) The açaí bowls are so refreshing and make you feel satisfyingly full because of how healthy it is. The peanut butter smoothie is fantastic (I'm not really a big fan of peanut butter but I still get it) the people are always welcoming and sweet. I really enjoy the environment as well, it's a cute little place and you can sit around outside as well. This is my favorite place to eat. I'm not the healthiest person in the world but I really do crave the açaí bowls often."
"8530 SW 124th Ave, Miami, FL 33183",1/18/2018,$$,4,MyRoots Juice Bar & Kitchen,"I am writing this review purely from the point of view as a customer, I used to work here a year ago and I will not relate my work experience to the establishment... The menu has a nice variety of choices to get, my favorite are the wellness smoothie (a fresh tasting green smoothie) and the crave smoothie(vanilla/cinnamon goodness). Another favorite of mine are the zoodles (zuccinni  noodles), they are served with a vegan bolognese sauce. I used to use the Yelp check in/20% off when I would come here but now they are saying they aren't accepting it anymore. If that is the case, take it off Yelp because it is misleading. This visit I ordered an avocado toast and a crave smoothie. The toast came out quickly but 15 minutes later I'm still here waiting for my smoothie while the girls behind the counter chat about stair masters and working out, usually they bring the food all together. As of customer service, associates could be friendlier maybe try smiling. Vegan = HAPPY"
"8530 SW 124th Ave, Miami, FL 33183",5/23/2018,$$,4,MyRoots Juice Bar & Kitchen,the time to get the food  it is my only concern...every thing else it is GOOODD AND FRESH.. i highly recommended to any vegan friends
"8530 SW 124th Ave, Miami, FL 33183",11/27/2016,$$,5,MyRoots Juice Bar & Kitchen,"Anyone that knows me, knows that I am not vegan by any stretch of the imagination.  However, I do love my smoothies & bowls and Roots delivers on both! I absolutely love their Dragon Bowl. I've had Dragon/Pitaya bowls around the US and even internationally. And in my opinion Roots' version is the best. All the toppings work well together and everything is o nicely presented. ,I have also tried their juice cleanse 2x. I do pretty well on 3 day cleanses with rarely a headache. They will offer suggestions on how to deal with any effects. The first time, I received all clear juices. The 2nd time, I received some of the same juices plus one thicker juice and one cash mylk. I think that the addition of the thicker drinks should help those that have a hard time with cleanses as the thicker juices/mylk are pretty filling.  ,The avocado juice was delish and the cash mylk was also tasty. I do not like celery and three of the juices contain celery. The green ones I chugged. While the beet juice was more palatable. I loved the morning juice.  Mind you, this is just my personal opinion. All in all, it was a great cleanse.,I have been coming here since it was the place for the best cuppie cakes on the planet (cough, cough). And the staff and owners have always been super friendly and welcoming. The shop is so cute and offers seating both inside & out. Orders are prepared once placed so if you are in a rush, you can place your order online right here on Yelp! And it will be ready for you to pick up."
"8530 SW 124th Ave, Miami, FL 33183",8/17/2017,$$,5,MyRoots Juice Bar & Kitchen,"Hands down my favorite Vegan Food Spot in Miami! My favorite thing is the ""Fajitas Bowl"" and the Love Potion #9 Juice. I also like the Frijoles Bowl and Dragon Fruit Bowl. The place is small but I love it inside. The atmosphere is good and everything is made to order so it tastes very fresh. I hope that they open up more restaurants in the near future and they should really think about opening on Sundays."
"8530 SW 124th Ave, Miami, FL 33183",1/12/2017,$$,4,MyRoots Juice Bar & Kitchen,"Roots is a very tasty juice bar, it has all the vegan favorites. I'm not vegan but I do like from time to time a healthy alternative. ,One of my side jobs is next door so it makes a nice and convenient meal/shake for me during my lunch break. ,I usually have my favorite the PB&j shake. Very tasty and full of flavor. ,If you've never had Avo bread before make sure you ask for it. It's tasteful and light! It'll sure make your tastebuds happy. ,If in the area and looking for something healthy and different try Roots out. It's sure not to disappoint"
"8530 SW 124th Ave, Miami, FL 33183",3/9/2018,$$,5,MyRoots Juice Bar & Kitchen,My go-to place for acai/dragon bowls and healthy vegan food. Everything I've tried was delicious. The place is also very cute and simple and the service is great.
"8530 SW 124th Ave, Miami, FL 33183",7/3/2018,$$,4,MyRoots Juice Bar & Kitchen,"Absolutely love the acai bowls from roots. They are reasonably priced, have tons of toppings and tastes delicious! The shop is really nice and clean inside, however, it is kind of small which makes it feel very cramped when it is very busy. There's not so many places to sit so I always opt for take out. The best way to do take out here is to either call ahead or order through yelp because there's not too much space to wait around if it's very busy. Made that mistake once and felt super claustrophobic. There isn't that much seating, there's a little community table which is cute but when the line gets long it feels like people are right on top of you. The decorations and style of the place are cute though. Definitely a cute little spot to hang out if it's not busy but if it is I would come back later or do take out. The food is definitely worth it though. It's one of the only vegan/juice bars in the area that have fresh fruits and are good quality without being overpriced."
"8530 SW 124th Ave, Miami, FL 33183",4/6/2018,$$,5,MyRoots Juice Bar & Kitchen,"Delicious place! Smoothies are alright, but let me tel you! THAT FAJITA BOWL WAS AMAZING!!! Prices were pretty average for a juice bar, not bad. staff was very friendly and attentive and hardworking! This place is a beautiful place spreading the vegan message. I like the steps towards being more green. Also I love that they had vegan smoothie bowls! Food was good, the smoothie was just what I needed!"
