address,date,price,rating,restaurant,text
"8211 S Dixie Hwy, Miami, FL 33143",10/12/2016,$$,5,grown,"Wow! Can't even begin to explain how special this place is. From the food, the vibe, and especially the owner, Shannon! We had the vegan & gluten free soup which was incredible!!! Also sampled the salmon burger & eggplant sandwiches which I'm craving already. They have many community events and specials so check out the instagram page. (That's how I found out about free yoga & yummy bites afterwards). The owner is incredible. Her mission is so clear and that is to spread the word about an organic lifestyle and cater to those who believe so deeply in it like she does. She literally went around from to table to table to speak to guests. If you aren't aware, she is Ray Allen's wife. The reason I bring that up is because she doesn't have to be running this restaurant, she has money. She does it because she truly has a passion and cares! She orders everything from the restaurant herself and makes sure it is locally sourced and organic! From the fruits, veggies, & meats! She also stores EVERYTHING in BPA free containers. Why would she do that? It is triple the amount of money and nobody will ever know. Again, because she CARES! What a beautiful lady , inside & out! Can't wait to go back (especially to try breakfast). By the way, GROWN caters to EVERYONE! Vegans, gluten intolerant, meat lovers...oh and wine lovers too! Check them out, you won't regret. P.S: For those complaining about price.. organic food (especially how they order) is pricey, you will not find that anywhere! Your body is a temple, take care of it! No amount of money can replace sickness or disease. There is no price on good health."
"2895 McFarlane Rd, Miami, FL 33133",7/24/2018,$$,5,Next Generation Pizza,"I don't want to give this review as a recent convert to veganism, but as someone who has traveled quite a bit and has experienced different cuisines from all over the United States, Latin America, and Europe. I purposely seek out small family owned restaurants and shy away from chains.,Buffalo Bob is probably the best pizza I have ever had. The chicken was very tasty and was not overpowered with buffalo sauce. The cheese was just perfectly extra on the pizza, and the crust was fantastic. We followed up with ice cream. I had the Brownie Sunday, which after I had customized it was more like some hardcore chocolate on chocolate action. ,On the owners advice we returned the next morning for pancakes and holy cow! The banana blueberry pancakes were fire. The scramble was not missing anything (coming from a recent non-vegan background its hard to fool me) but my favorite was the sausage patties.,Ethically sourced food this good makes the conversion to full veganism a no brainer. Why not promote peace and love for our fellow creatures and inhabitants of this fascinating rock hurtling through space at 26 thousand miles an hour through some damn tasty food?!"
"2895 McFarlane Rd, Miami, FL 33133",7/13/2018,$$,5,Next Generation Pizza,"Knowing how great Choices Organic Café is, we knew we had to try this pizza place as soon as it opened. The outdoor seating setup is the same casual Grove dining as Choices, and the order by tablet option was quick/painless. While we ordered with the tablet, all of the staff were super nice and updated us as we waited on our pizza. Speaking of the pizza (Helen of Napoli): it was absolutely incredible, made to order with fresh ingredients, and worth the wait. We both agreed that it was the best vegan pizza either of us had ever had. It's essentially potatoes au gratin/loaded baked potato over a spectacular, risen-crust pizza. It was perfectly paired with a cup of delightfully sour mango lime kombucha to wash it down. Do yourself a favor and get some of this pizza in your mouth!"
"2895 McFarlane Rd, Miami, FL 33133",7/1/2018,$$,5,Next Generation Pizza,Calling all vegans and non vegans!! Best vegan pizza hands down. The dough and cheese were both delicious. Comfort food pizza at its finest. I came with a big group and we got all the pizzas. The blueberry one was delicious. Definitely more savory than sweet so it was a nice surprise! Coming back next weekend for the opening of the ice cream shop!
"2895 McFarlane Rd, Miami, FL 33133",7/9/2018,$$,5,Next Generation Pizza,"Hands down best pizza I have ever had, vegan or not. The first time I showed up they were closed and cleaning up and still offered to bake up 3 pizzas and make 3 smoothies from Neo's Blender (in the same VShops Food Hall). Paid parking lot next door is easy but I have heard they boot if you are even a minute late, but for $3/hour ($1/20 mins), pay the extra :),I have had the Buffalo pizza and the BBQ chicken pizza."
"2895 McFarlane Rd, Miami, FL 33133",6/29/2018,$$,5,Next Generation Pizza,"It's in the building with the blue umbrellas. Holy crap was this phenomenal vegan food. Just order the blueberry pizza. It's incredible. My wife got the buffalo bob and it was ""the best buffalo item I've had since going vegan."",If you're vegan you need this experience."
"8224 Biscayne Blvd, Miami, FL 33138",12/6/2016,$$,5,Cream Parlor,"This has to be one of the most charming places I have ever visited in Miami....and beyond!Where do I begin? First of all, the staff is so friendly; the owners are incredibly accommodating with a kindness beyond compare and the food is to die for. Everything from the warm toasted paninis to the delectable ice creams. It's all so amazing. There's a cozy back patio, too. And vegetarian \ vegan options too. At Cream Parlor, every experience you have is a memorable one. DEFINITELY RECOMMENDED!"
"8224 Biscayne Blvd, Miami, FL 33138",10/3/2016,$$,4,Cream Parlor,"Im in love with this iscream parlour! The place is cozy with a few tables inside and there is a very nice outdoor patio in the rear that I loved. I enjoyed convo, icecream and the Avocado vegan toast there and felt very relaxed and comfortable. definitely a go to on an easy beeezy Sunday night!,I had a scoop of the unicorn poop + a scoop of the rum raisin and they were both delicious...nothing out of this world flavor wise but ice cream is ice cream.,Very family friendly place and I might be a bit weird but I wish they served some wine here for the grown ups too, while the kids enjoy their cones. the food menu needs some work as it relates to a more varied options but overall. I loved the ambiance. Wine, would make it truly official in my book.,."
"8224 Biscayne Blvd, Miami, FL 33138",8/30/2017,$$,3,Cream Parlor,"This place is good place to enjoy some very delicious ice cream, if you are not vegan then you would love Cream Parlor they invent new ice cream flavors every week which I think is amazing plus their food is also very full of delicious flavors, I would just say that the food is vey greasy so you might want to watch out for that ..."
"8224 Biscayne Blvd, Miami, FL 33138",1/10/2018,$$,5,Cream Parlor,"Oh my god! This place so so cute and has awesome food and service. It definitely exceeded my expectations. I ordered the curry bowl and the hummus makes it so BOMB!!!!! So flavorful and tangy and slightly smoky. Excellent vegan or vegetarian option. I also had the prosciutto toast with the apricot jam and goat cheese. Ugh, the flavors in my mouth...I saved a bite to have as the last thing in my mouth. My friend got a smashed potato with eggs bacon and cheese and she loved it. They take a whole baked potato and press it in the panini press until it becomes crispy and delicious and then topped it was eggs, cheese , and a mountain of bacon. And then the dessert. Make sure to try their ice cream flavors and then get an out of this world Sundae or malted milkshake!"
"8224 Biscayne Blvd, Miami, FL 33138",9/27/2017,$$,4,Cream Parlor,"Feel like I found a gem not far from home! Love this place because offers a variety of delicious meals , with many vegan options as well on a very cute and unique ambience.  It's very family friendly and My children's really like it.  I Just love it!! Will come back over and over again real soon ,   One of my favs. Are the hummus with warm pita , the petal rose latte , rose petal lemonade , unicorn poop ice cream and purple rain ice cream as well."
"186 SE 12th Ter, Miami, FL 33131",12/7/2017,$$,5,Nikko By Sunshine,Nikko has been my go to Thai restaurant. They are always willing to accommodate my request to make certain dishes vegan and answer any questions I have with regards to a dish and what it contains. I have the pad thai with tofu and their coconut soup. Their food is always delicious and I would highly recommend trying them.
"301 Miracle Mile, Coral Gables, FL 33134",6/3/2018,$$,5,Doc B’s Fresh Kitchen,"Have been here three times and really like this place! Waitstaff is super friendly, great decor and awesome food. Portion size is generous and lots of variety for vegetarians/kosher/vegans (all of who we've eaten with here). Would def recommend for brunch or dinner!!"
"301 Miracle Mile, Coral Gables, FL 33134",8/3/2018,$$,5,Doc B’s Fresh Kitchen,Great atmosphere! Plenty of Vegan options! I had the Tofu Wok Out Bowl and it was delicious! Our waitress was friendly and extremely helpful. I'll be back! Recommended!
"8211 S Dixie Hwy, Miami, FL 33143",7/17/2016,$$,4,grown,Excellent food overall. Had the free range chicken wrap Capri Salad Style along with a vegan minestrone soup. A little pricey but worth it in my opinion for a fast food type of place.
"8211 S Dixie Hwy, Miami, FL 33143",5/25/2016,$$,4,grown,"A nice fast food restaurant. The employees were very friendly. They greeted each customer immediately at the door. The sitting area was very cute. The tables were a little small but I think that for a fast food restaurant it is not a big issue. We ordered two smoothies, a salad with Havana vibe and salmon, and a wrap with salmon. The food came with soups - Chicken tortilla and Gluten Free Vegan Minestrone soup. The food was very good. All ingredients were fresh and tasted delicious. The only thing that surprised me was the bill. The food is a little bit too pricey for a fast food restaurant. The total bill was $58! But I guess they have to pay the Pinecrest's rent!"
"8211 S Dixie Hwy, Miami, FL 33143",4/30/2016,$$,5,grown,"Only been open a month and is doing very well! Everything on the menu is incredibly fresh , the ambiance is adorably cute, and there is open-air (covered) seating. I had the Grown Simple Greens wrap and Gluten Free Vegan Minestrone soup which were delicious. The silverware and plates are made of renewable materials and the juices are amazing. Try the Love Greens!"
"8211 S Dixie Hwy, Miami, FL 33143",4/4/2017,$$,5,grown,"Food that tastes great and makes you feel good ordering. Everything is USDA organic. This is also an excellent place for vegetarians, vegans, people with dietary restrictions, allergies, etc. ,The salmon was fine dining quality on a paper plate. I recommend trying the Mexican corn. ,Since it is was our first time, the manager, Chris, walked us through the menu and gave us samples to try. Bonus points for excellent service. ,As others have mentioned, this place is more expensive than other counter service restaurants, but I would argue the food quality and taste is MUCH better. We enjoyed dinner so much, we splurged for dessert (something we rarely do). Excellent too!"
"8211 S Dixie Hwy, Miami, FL 33143",1/4/2017,$$,4,grown,"I enjoyed my visit here when I came early on a Saturday morning with my boyfriend. The food was tasty enough, and there were plenty of vegan and vegetarian options. The reason why I give this restaurant four stars instead of five is because it was extremely pricey for the portion sizes we were getting. We both left feeling hungry after spending $xx amount on our breakfasts. I wish they had bigger portion sizes. Also, it gets very crowded on weekends, mainly with local families coming after a soccer match, etc."
"8211 S Dixie Hwy, Miami, FL 33143",3/30/2017,$$,5,grown,"I loved this restaurant!!  I had the wild salmon on a gluten free wrap with the simple greens, soup was included and I had the chicken and mushroom. My soup was very tasty and my wrap was scrumptious!  I was only able to have half of my wrap because it's quite large so next time I'll order an extra soup and share the wrap. I didn't have dessert but on my way out saw they had vegan and gluten free desserts which I will try next time. Can't wait to visit them again. ,Ps- I was very impressed that they had Rudi's gluten free bread, wild salmon and free range chicken. I wish I would've had access to a ""fast food restaurant"" like this when my kids were small. I'll definitely be taking my grandkids!"
"8211 S Dixie Hwy, Miami, FL 33143",10/16/2017,$$,5,grown,Stopped in for lunch for the first time.  Simply amazed! The owner Shannon was very wonderful and informative on the healthy styles of eating. We were offered a complimentary dessert that was vegan delicious.
"8211 S Dixie Hwy, Miami, FL 33143",6/5/2017,$$,3,grown,"I heard a lot of hype coming into this place, and while the food is fine, it's nothing all that outstanding.  I came for breakfast, and it seems like a great deal that you can get home fries, bacon, and fruit for $5, until you see that it's less food than you would've gotten for the same price at IHOP.  For all the gluten-free, local-source, vegan-friendly, blah, blah, blah, you see, the food was pretty bland and basic.  I'm not saying the food isn't good.  I'm just saying that their cage-free, macrobiotic, whatever, whatever eggs taste the same as what I have in my fridge from Publix.  Now, I'm not going to lie, their juices and smoothies are really good, but they set you back about $10.  If paying $10 for a great smoothie is something that wouldn't bother you, then grown is right up your alley."
"8211 S Dixie Hwy, Miami, FL 33143",7/1/2018,$$,3,grown,"So, this place is delicious and healthy and yes everything tastes extremely fresh and natural however ridiculously overpriced. TWO wraps and a cookie came out to $42!!! What?! Kind of insane. I was shocked at how expensive it was. I tried the Mediterranean wrap and the Havana wrap both with chicken- they were delicious I can't deny that. The vegan chocolate chip cookie was also amazing- very flavorful and yummy. Decorated very cute. I wish there were more places like this- they even have a drive thru. My only complain was the price and it's a shame but I wouldn't return because of it."
"3401 N Miami Ave, Miami, FL 33127",1/22/2012,$$,5,Sakaya Kitchen,"The vegan BBQ tofu special - brown rice, baby bok choy, and Miami's best Brussels sprouts - is incredible and unmatched by anywhere I've been since my last visit, including my own kitchen (though my pan-fried tofu is better). With sides of cucumber pickle (kirby cucumbers sliced in what I thought was sweet rice vinegar) and kimchi (better than what I got in the farmers' market at Fort Greene in Brooklyn): $13.90 before the tip. ,I ate here twice a week for about five months, and it was always a treat! You must try the fried shrimp. It's only the second place where the shrimp was so nicely fried that I could eat the shell, which can be really tasty. ,Props on the tunes! And shout-outs to Malika and Maylin and the entire team."
"15 NE 11th St, Miami, FL 33132",6/4/2015,$$$,4,Rooftop At E11even,"Good vegan sushi, impressive! I will be back"
"3401 N Miami Ave, Miami, FL 33127",7/27/2018,$$,5,Sakaya Kitchen,"The food was soooo good! They gave plenty of substitute options and gluten free, vegan, and vegetarian options are available as well! The Bulgogi sandwich, KFC, Bok Choy, Jasmine rice and Korean beef are awesome! On top of that Pat, the cook, came out to make sure everything was great. She is ,! Very highly recommend!"
"250 NW 24th St, Miami, FL 33127",4/20/2018,$$,3,Crudos Fusion Art,"Im a vegan , so the menu did not show any vegan options , so I asked the waiter if it was possible to make something vegan and she was really friendly and explained to me that the chef could make any plate vegan. ,Went on a Thursday and they had a DJ with pretty good music . ,Food was good a little salty but I enjoyed it , may be could be better for non vegan .,We had the check and and they charged same price as if meat was included , we asked the waiter if she could was why and she did but the chef just said that he put more vegetables , thought that ,was not the right way to handle not a great customer service on his part but I guess he is not the owner so he did not care!!"
"228 SE 1st St, Miami, FL 33131",4/17/2015,$,5,Freshko Gourmet,"I ordered for delivery and food was here promptly. I ordered the ""vegan salad"" and their hummus, I know doesn't seem like much, but that meal was delicious!!  The salad was super fresh w baby arugula and the hummus and some of the best I've had around downtown Miami! But heads up, you can't add tip to your receipt once the meal arrives, you have to add it in advance. The deliverer was also extremely nice, and I owe him a few more bucks!"
"140 NE 39th St, Miami, FL 33137",5/28/2018,$$,5,ITAMAE,"Start off with a fresh tatami small plate, and work your way through the entire menu please - you won't be disappointed. Vegan or gluten allergies? No worries, Chef Fernando always got your back. My favorite dish is the Nikkei Bowl. Favorite sushi is the Lost in translation or the Sansho (creamy a.f.). Pro tip: pair it all with their japanese bubbly sodas."
"228 SE 1st St, Miami, FL 33131",12/19/2016,$,5,Freshko Gourmet,"Delicious soy cappuccino. I subbed the mozzarella in the veggie panino with their balsamic vinegarette to veganize it, and it was super yummy. Great service. Reasonably prized. Perfect ambiance for a relaxed weekend brunch. No wait to be seated on a Sunday afternoon."
"228 SE 1st St, Miami, FL 33131",8/21/2017,$,5,Freshko Gourmet,"This place is pretty cool the food was fresh and the service was okay being that there was only one server. The vegan salad is arugula, quinoa, tomatoes and cucumber was delicious."
"900 S Miami Ave, Miami, FL 33130",5/6/2015,$$,4,Burger & Beer Joint,"It's a decent place with a nice outdoor seating area, plenty of craft beer on tap and the staff is awesome. Of course, being Vegan I thought it would be difficult to find something here but they had a great Kale and Quinoa salad option. Only problem, they were out of Kale which I'm told happens often. If you're going to offer something that people will like as an option why be out of it since Kale is not plutonium. In other words, you can get it in every supermarket! They substituted with Spinach which was fine and the quinoa was awesome. I would definitely come back but they better not be out of Kale again."
"900 S Miami Ave, Miami, FL 33130",2/10/2018,$$,4,Burger & Beer Joint,"For vegans: There's a veggie burger (quinoa, beans, peppers), a quinoa & kale salad, and sweet potato fries/ skinny fries. They also have ""duck fat"" fries.... make sure to differentiate. The others in my group had plenty to eat, and enjoyed it. I had a nice glass of wine. The food was ready very fast and was reasonably priced."
"5600 Biscayne Blvd, Miami, FL 33137",3/20/2017,$$,5,Andiamo,"I was stuck on a field trip and a classmate recommended we sneak away for pizza. I was game since I'm vegan and didn't want to struggle to get vegan options in Little Haiti. Our server, Jennifer, was great. It's never fun to be the vegan asking about what's in the crust, etc. But Jennifer was nice and patient and checked things for me. I loved my pizza! So delicious! My non vegan classmate's pizza looked amazing! The other classmate got a salad which looked ok. Thank you Jennifer!"
"7535 N Kendall Dr, Miami, FL 33156",1/3/2018,$,4,Spoleto,"Been to Spoleto at Dadeland Mall twice and loved the fresh options, generous portions,  homemade pasta and Flatbread. They make everything in front of you from scratch!  Food is definitely better than anything in the food court and much better prices than the larger restaurants.  For the most part a very committed young staff. Make sure you are very clear when you are specifying vegan or vegetarian."
"3000 N Miami Ave, Miami, FL 33127",9/4/2017,$$,5,Mabruk,"Amazing food,falafel was tasty and fresh! Cheaper than other places in the area. Hummus was delicious and so was taboule salad , great customer service our fave new place ,great option for vegans !!"
"3791 Bird Rd, Miami, FL 33146",3/6/2018,$,4,El Rinconcito El Chele,"Good  (not great) food. Staff is a bit rude on the phone. If you do not speak Spanish they will hang up on you. They have a nice selection with options for vegetarian diets, vegan diets, and those with food allergies. Delivery time can take a while but over all decent for quick meal."
"321 Miracle Mile, Coral Gables, FL 33134",1/23/2015,$$,5,Seasons 52,"One of the absolute BEST restaurants in South Miami. Everything here is perfect, the service, ambiance, and food are impeccable, and I am never disappointed. I took my parents here when they were visiting, and as huge foodies my dad said the veal was the best he has ever had, while the menu also has dishes for me (a vegan). The price is more than fair for the quality of meals, and you will NOT be disappointed. Season's 52 has my highest recommendation possible."
"321 Miracle Mile, Coral Gables, FL 33134",6/15/2014,$$,5,Seasons 52,"This was the perfect location for my medical school graduation lunch. Service was great, food was delicious and we loved our experience. I would definitely go back and have another meal. I also liked the fact that they had a vegan menu for my Aunt and they are über accommodating for those with dietary needs."
"321 Miracle Mile, Coral Gables, FL 33134",12/27/2015,$$,5,Seasons 52,"This is a great restaurant for those who care about healthy food and, especially, for vegetarians. Ask for the vegetarian menu. There's also a gluten-free menu, and a vegan menu -- you just have to ask. The options are extensive and include a Winter Vegetarian Tasting plate. Highlights from our meal today included the Warm Roasted Tomato Caprese Salad, the Roasted Basciani Farms Mushrooms, and the vegetarian soft taco. My partner had the trout and was very pleased. For dessert, our favorite was the Blueberries with Lemon Curd. I also recommend the cocktails -- Meyer Lemonade is very tasty. Our waiter, Camillo, was fantastic -- kind and attentive."
"321 Miracle Mile, Coral Gables, FL 33134",2/15/2015,$$,3,Seasons 52,"Overall, Season's 52 was a solid experience.  My husband and I were looking for a vegetarian restaurant (in addition to my gluten and dairy allergies).  Their menu was a little bit inefficient since they have separate menus for gluten-free, vegetarian and vegan.  It was a bit overwhelming for me since a majority of the gluten-free menu was non-vegetarian.  However,  our server quickly found someone who could manage it and make recommendations.  We ordered the duo hummus for an appetizer, and I found the texture to be a little rough.  We had the warm beet salad, which was good and the vegetarian entree which was good as well and the restaurant accommodated my food allergies greatly in this meal.  ,If you go to the restaurant, i would recommend sitting in the main room or room adjoining to the bar.  We were put in an add-on room, which was freezing.  I complained several times, and 2 other tables near us complained about how cold it was too."
"321 Miracle Mile, Coral Gables, FL 33134",6/8/2016,$$,5,Seasons 52,"Delicious menu and great ambiance! They have food for everyone! Gluten sensitive, lactose free, dairy free, sodium friendly, vegan and vegetarian!! Plus they have 52 glasses of wine by the bottle!! Not to mention the service was amazing!"
"321 Miracle Mile, Coral Gables, FL 33134",7/25/2017,$$,5,Seasons 52,"I've come to Seasons 52 a number of times and it does not cease to disappoint when it comes to the seasonal menu, the freshness of ingredients and the atmosphere are all great reasons to keep coming to seasons. And lets not forget their stuffed shrooms, which are absolutely a must try. I would come back and just order them and nothing else. I think their flatbreads are also pretty great and a surefire way to get in a good meal, however I wouldn't vouch for their brunch flatbreads. I would have been fine without the smoked salmon flatbread. I would come back again though, but would come back more so for the dinner menu. I would also recommend this restaurant for vegetarians and vegans, has pretty decent options. Their desserts are also a small but filling indulgence that doesn't make me feel too bad for breaking my diet."
"7378 Bird Rd, Miami, FL 33155",11/1/2016,$$,5,Bangkok City Thai & Seafood Restaurant,"Bangkok City has been recommended to me by COUNTLESS people since I moved to the area about a month ago. I thought to myself, not everyone can be wrong about this place so I'll give it a try, even though I already have my usual Thai restaurant. I started with the basics - tom-coconut soup, pad thai, and red curry tofu, ALL were out of this world. The curry dishes in particular really blew me away. It's not just the cuisine here that's incredible, but the staff is so welcoming and nice that it almost makes me want to stay and eat there when I'm picking up a to-go order! As a vegan, I now eat here at least three times a week since I can get veggies and tofu made in so many different ways. Bangkok City is now my go-to spot for Thai or sushi."
