address,date,price,rating,restaurant,text
"115 SW 107th Ave, Miami, FL 33174",7/16/2015,$,5,Vegan & Juice,"This place gets 5 stars; not because it is some Miami high end cuisine or because it has specialty imported products. It doesn't embody either of those things. Vegan and Juice is family run community service. These people work hard to bring healthy vegan food to people that want or need it.,This also isn't the kind of place you go to just once. Rather it is the kind of place you continue to visit because you know deep down that their yummy delicious food somehow resonated with what your body was really craving."
"115 SW 107th Ave, Miami, FL 33174",3/11/2014,$,5,Vegan & Juice,"Few times I can find a vegan cafeteria in Miami worth re visiting. Vegan and juice is just that! Juices run for 3.75 (traditional apple, mango, orange,,carrot etc) with power juices for 4.50. My favorite is the fat burner (grapefruit apple pineapple). ,Wraps and sandwiches are avail within the 6-7 dollar range, all mostly a tofu based sandwich. I have also heard many good things about their pizza Thursdays (3$ a slice). ,As I'm sitting here writing this I have just consumed a yuca puff (filled with spinach mushrooms peppers and tomatoes), so good no time for a picture. Menu changes daily to reflect 8-10 specialty dishes. Special of the day includes 4 vegan sides all for a total of $8.50,They have a variety of vegan and gluten free deserts including various cakes, cupcakes, ice cream, cookies-even pastelitos ,Service is fast efficient and always friendly. Very comforting to see the same faces frequently who know what you want and how you want it. I cannot praise this place enough :)"
"115 SW 107th Ave, Miami, FL 33174",11/5/2016,$,5,Vegan & Juice,This place is awesome and the avocado wrap is as good as it sounds. I highly recommend this place for all you vegan needs.
"115 SW 107th Ave, Miami, FL 33174",5/3/2016,$,5,Vegan & Juice,"Easily the best vegan restaurant in south florida! I come here whenever I get the chance. The avocado wrap is 2 die 4. The smoothies are perfectly sweet. The hot food is my favorite, you rarely see the same two dishes and they're all very creative, innovative meals. Staff is super friendly. The desserts are deliciously decadent. I've never had a problem with this place (aside from the fact that my inner environmentalist despises all the plastic and styrofoam used, but a vegan diet is pretty green so I suppose that cancels out the waste). Can't say enough great things about this place!"
"115 SW 107th Ave, Miami, FL 33174",7/25/2015,$,5,Vegan & Juice,"This place is fantastic. When you first enter, people are always hesitant to try the food because it's not your regular vegan food, but do it anyway! I love plantains so everything they do with them is always fantastic. Their juices are also delicious and nutritious. I always want beets in my juice as a pick me up and I love the reggae and recover. Their desserts are also to die for! My favorite is the tangerine, but they're all so good!! Be bold and check them out, you won't regret it!!"
"115 SW 107th Ave, Miami, FL 33174",7/26/2016,$,5,Vegan & Juice,"This place is a godsend in this area. The food is incredibly delicious, I'm not even a big vegan eater. The juices and smoothies are so fresh and the prices are great."
"115 SW 107th Ave, Miami, FL 33174",3/12/2016,$,5,Vegan & Juice,"Can I please have a moment of silence for this gem!!!!! Totally in love with this vegan restaurant. First time coming and for sure it would not be my last! Specially when it's located so close to the FIU engineer campus! I ordered the eggplant lasagna  with cabbage and sweet potato mashed! Perfect combination of colors, flavors, amounts! I also order a juice so I can complement my amazing lunch! If you're coming on a Saturday make sure you come before 4 since they do close earlier! I noticed that the a big portion of people that was siting around me where elder, which is good! That tells me that they feel at home eating here! Also a lot athletes come here!!. Even if you're not vegetarian, you should definitely come and try it!"
"115 SW 107th Ave, Miami, FL 33174",4/27/2016,$,5,Vegan & Juice,"So good!!! This little hole in the wall is one of the very best vegan places I've ever been to. It's super homey, and the customer service is on point. All the juices here are ,. Try the avocado wrap; it's heaven in wrap form. They also have a hot entree area, which I haven't tried yet, but it smells amazing. It's not the cheapest place, but considering all their ingredients are natural and wholesome, it's worth the price. Check them out!"
"115 SW 107th Ave, Miami, FL 33174",3/29/2017,$,5,Vegan & Juice,"Such a teeny tiny space that packs a punch of awesome vegan food! Everyday they have a new menu but they also have the their usual favorites. Did I mention it's all decently priced??? And they have pizza Wednesdays! Its first come first serve :) And it's conveniently located near FIU so I can pick up some food after class! Great, delicious, and healthy food!"
"115 SW 107th Ave, Miami, FL 33174",2/6/2017,$,5,Vegan & Juice,"Outstanding restaurant! Wonderful service, even more wonderful food. Very reasonable pricing. Never a disappointment when I come into Vegan and Juice! :)"
"115 SW 107th Ave, Miami, FL 33174",2/18/2016,$,5,Vegan & Juice,"Excellent customer service. Plenty of flavors and options. Price is on point. Juices, wraps, sweeties and nice cooked food. It doesn't get better than this. This place is a good example that vegan food doesn't have to be boring or expensive. I wish I lived closer."
"115 SW 107th Ave, Miami, FL 33174",12/14/2016,$,5,Vegan & Juice,Went in with my mom to get some authentic vegan food which is hard in Miami. Had the veggie wrap and hummus pie which was fantastic. Also the spinach taqueria were incredible. Would come here again !!
"115 SW 107th Ave, Miami, FL 33174",12/9/2015,$,5,Vegan & Juice,"This is the best vegan spot in Miami! I am so thrilled I found this place on yelp. Everyone was amazing friendly and sweet and took care of us without any trouble. The homemade food that they have prepared is so delicious and their made to order juices are so refreshing. I can't wait to go back! ,It's small but full of love, amazing food, and great people."
"115 SW 107th Ave, Miami, FL 33174",8/4/2017,$,5,Vegan & Juice,"Went for lunch for the first time today and simply stated, fantastic.  Food was delicious and pretty unique compared to other vegan restaurants.  Simple ordering, pick 4 of the 6 or so dishes, or a wrap, maybe add a juice, and you're set.  We had two of the entree pick 4, a juice, and a smoothie for about $30 so very affordable.  Price and selection plus the flavor, they've got all three.  Highly recommended, vegan or not."
"115 SW 107th Ave, Miami, FL 33174",9/13/2015,$,5,Vegan & Juice,"My very first experience with vegan meals, and boy was I pleasantly surprised! ,For starters the menu is updated daily and although it's a lil drive for me, it's totally worth it. ,I had the egg plant lasagna, malanga, mixed veggies and brown rice. ,Ok so the malanga was the most delicious thing I've ever had in my LIFE! The lasagna was great and so were the mixed veggies! ,If you come during the lunch time rush, be prepared to miss certain items on the menu, when they're out they are out.,Enjoy!"
"115 SW 107th Ave, Miami, FL 33174",7/22/2017,$,5,Vegan & Juice,"Fresh food made daily, lots of variety, and delicious!  I can't believe their desserts are vegan because they are decadent. I highly recommend this place."
"115 SW 107th Ave, Miami, FL 33174",7/21/2015,$,5,Vegan & Juice,"This is officially the best vegan food in Miami! Francisco and his crew are the hippest and healthiest Latin peeps I've ever encountered. The food is abundant, mouthwatering and super affordable. For less than $10 you can have a complete cooked meal with 4 items. They also make fresh wraps and salads cut and prepared right before your eyes. And let's not leave behind their signatures juices : Energy, Flu Blaster, Leafy Lemonade and a parade of other tantalizing combos. Dessert you said? Cupcakes, carrot cake, mandarin cake and cinnamon rolls are only a few of the sweet, animal free goodies you can choose from. ,If it's your first visit, go before noon or after 2 because lunch hour can be chaotically busy and you'll be waiting in line for a bit. They are also open on Saturdays. ,Enjoy this culinary gem!!!"
"115 SW 107th Ave, Miami, FL 33174",11/10/2017,$,5,Vegan & Juice,"This is probably my top three favorite food spots in Miami.  I cannot believe that the deserts are vegan because of how tasty they all are.  This is vegan food with a latin influence and boy is it delish.  The prices for the food being vegan are extremely reasonable.  Today I began a meal plan which Vegan & Juice offers that is five meals for about $8 each!  This is unheard of for quality, freshness, and tasty food."
"115 SW 107th Ave, Miami, FL 33174",3/17/2017,$,5,Vegan & Juice,"It doesn't look like much from the outside, but delicious vegan food (I'm not even a vegan). It's family owned and the staff is so friendly. The hot food they serve daily is always fresh and tasty. They also make wraps, hummus, and smoothies - all great."
"115 SW 107th Ave, Miami, FL 33174",2/20/2015,$,5,Vegan & Juice,"A family owned Dominican vegan place located in a old mall in the 107 and flagler.  Simple place, small entrance and nothing fancy inside.  They offer salads, wraps and juices, but their true specialty is the vegan cantina. For around 10 usd you can choose four plates from the daily options prepared. The menu varies, and portions have good size. You can find options ranging from dsily soup, quinoa, vegetables, veggie lasagna, stuffed plantains, stuffed peppers, red beans and several other creations depending on the day.,If you are not in the mood for the cantina you can always ask for a special salad or wrap. Their mix of juices is excellent too. ,At lunch time place is always full. They have around 6 or 8 tables and a bar. The staff is friendly and attentive, the  locals that come here do so several days a week. The ambiance is good.  ,If you have any question about food or ingredients they will answer al your doubts and questions.  They sell also some natural supplements.,Great place for healthy food."
"115 SW 107th Ave, Miami, FL 33174",9/26/2017,$,5,Vegan & Juice,Best vegan place I have been to in Miami so far. Healthy food and a lot of choices. this a small family owned business but the food is homemade and delicious.
"115 SW 107th Ave, Miami, FL 33174",11/1/2017,$,5,Vegan & Juice,"My first time here and I had to comment on the amazing customer service, cleanliness, and the amazing vegan food. There's not much vegan places around in this area, but I am so happy I found this family owned vegan restaurant. The green juice I got was delicious and fresh and the food is made fresh everyday. It's as if I cooked it at home myself, the food is true Home Vegan cooking and you can't help but get a homie feel while eating it. Get the lunch special, it is super filling and great taste with every bite. I am coming back every time I have an opportunity for lunch from FIU."
"115 SW 107th Ave, Miami, FL 33174",9/13/2017,$,5,Vegan & Juice,This place is awesome !!! Great tasty juices !! Vegan food that is tasty and filling at a really affordable price . The staff is really nice and friendly. Give it a go if your into healthy food that also taste really good !
"115 SW 107th Ave, Miami, FL 33174",1/4/2016,$,4,Vegan & Juice,"i'm jumping on the bandwagon and trying the ""meatless monday"" fad. I don't know much for vegan/vegetarian options so i OBVIOUSLY yelped my little heart away. just my luck, theres a vegan place (with good ratings) near by. ,we got there around 4pm and they had sold out on majority of the hot foods so all they had to offer were wraps. i had the avocado wrap and my friend had the hummus wrap with added quinoa. ,you can tell everything was fresh. i want to go back to try the hot food and some of the juices."
"115 SW 107th Ave, Miami, FL 33174",4/4/2017,$,5,Vegan & Juice,"Delicious vegan food and juices! Super close to FIU and very affordable. I always get the avocado mambo wrap, it is delicious. All their food is amazing, i definitely recommend it."
"115 SW 107th Ave, Miami, FL 33174",5/15/2017,$,5,Vegan & Juice,"Incredible options for a vegan dishes... Friendly staff, and the owner works the counter... It doesn't get any better than this I highly suggest trying this location"
"115 SW 107th Ave, Miami, FL 33174",7/5/2017,$,5,Vegan & Juice,"This is one of my go-to places! Its a little hole in the wall, but my oh my what a treasure!! Its family owned, when you walk in they greet you so warmly, you feel at home. The have the most delicious variety of vegan foods and desserts. They offer a daily special, for $9 you can pick 4 items from the menu, but not to worry...the menu changes every single day. Everything is delicious trust Me! Juices & Smoothies are great too, and if you want to customize your own, you definitely can. Give this place a try, you won't regret it!"
"115 SW 107th Ave, Miami, FL 33174",10/19/2015,$,5,Vegan & Juice,"I've been coming here since I've been Vegan  (over 3 years) the food is delicious.. homemade cooking, juices, smoothies ugh I'm in heaven here! I always drop in at least for just a delicious slice of vegan pie for under $4!! ,The prices are amazing as well as the staff.. it feels like family everytime I go. Thanks for always being the best vegan restaurant I've come to ear at so far... nothing compares!! I love Vegan & Juice!"
"115 SW 107th Ave, Miami, FL 33174",5/11/2017,$,5,Vegan & Juice,"Even if your not vegetarian/vegan you will love this place!!! I'm a student at fiu and this is the most delicious, reasonably priced vegan food around. It's soooo nice to have a place make food with Latin flavors that I can eat! You can get a completa (4 choices of their daily specials that are constantly changing) for just 8 dollars. Their juices are amazing, my favorite is the leafy lemonade (juice of kale, lemon, and apple). From the fixed menu they have, I'm obsessed with the avocado mambo wrap SOOO FLAVORFUL. The food is healthy and leaves you feeling great. ,Everyone that works there is SO SWEET. They are all amazing and do a great job. Keep it up"
"115 SW 107th Ave, Miami, FL 33174",3/1/2018,$,5,Vegan & Juice,"This has become my new favorite place in Miami ! I am so blessed that my boyfriend has moved 2 minutes away from this place I can just roll here or maybe even go twice a day whenever I want ... I usually get the hot bar food but I'm just a broke college student I swear everything looks delicious id buy it all if I could all at once and have a heavenly feast. Ive only tried the mamey, strawberry, pineapple (I think) smoothie but it was so good I can't stop getting it, it tastes like candy I'm scared to get anything else. They press the juices in front of you and make the salads and wraps in front of you in a bar style area. There's also limited seating in the back. Come early !!! It's first come first serve for hot food and trust me you don't want to miss the hot food. Options change daily so I'm never bored of going there. I actually find it super fun guessing what's gonna be on the menu that day, it's huge portions for extremely cheap. It's your favorite food from your Hispanic mom or dad but vegan style !! The staff is extremely friendly makes you feel like you just walked into a family's home ! I love seeing vegan places so packed even with so many non vegan people ! Great food like the one from here is what we need so people can see that it's possible to go vegan and eat good. Not the weird gross cold plant stuff I usually experience. I Will forever keep coming here"
"115 SW 107th Ave, Miami, FL 33174",7/4/2017,$,5,Vegan & Juice,"I eat at Vegan and Juice for a lunch at least two times a week. ,The food always tastes great, their staff is very nice all the time, and the portions are filling. ,Definitely try it out!"
"115 SW 107th Ave, Miami, FL 33174",11/30/2017,$,5,Vegan & Juice,"Best vegan food that we could find in our trip to Miami , very friendly staff. try it you won't regret ;)"
"115 SW 107th Ave, Miami, FL 33174",11/18/2017,$,5,Vegan & Juice,"I've been living near FIU for for a year now and Vegan and Juice is hands down my favorite vegan spot. It's tiny and cluttered inside, but I guess that can be typical of Miami - a bunch of tiny shops stuffed into one shopping center. The food is perfection - tastes like fresh, homemade, cruelty-free, real food. And I always get a juice - 5 bucks is nothing for a fresh juice that they make right there in front of you. The styrofoam cup they're served in isn't the cutest, but at least it's not plastic so I guess it's better for the environment this way. The empanadas are good but different, don't expect the typical fried dough, it's more bready and baked it seems? Still tasty, though. Everything is good, just go here."
"115 SW 107th Ave, Miami, FL 33174",3/14/2017,$,4,Vegan & Juice,"I'm not vegan but I really wanted to try this place out since I live close by. The reviews were phenomenal. I arrived past 3 and by that time most of the Today's special menu was gone with about 3 things left. I opted for the avocado wrap that everyone raves about. It's good and tasty. Very fresh. I probably would give this place another shot (much earlier) for their special of the day foods. The staff is very friendly. Family run business which is nice. ,Value wise I think it's okay. It's a little on the pricey side. Almost $8 for the wrap. I get I'm paying for quality but it is veggies..."
"115 SW 107th Ave, Miami, FL 33174",11/29/2016,$,4,Vegan & Juice,"Love this place! I've been trying to reduce my overall meat intake and dedicating two days of the week to be fully plant based and that's what led me to look for this place. This is an all natural, all organic, plant-based, vegan friendly, vegetarian friendly whole in the wall. Every morning they make lots of different dishes and they run out super quick! Everything is fresh and home made. If you don't get there early enough they have a regular menu filled with delicious wraps, salads, smoothies, and juices. ,The ambiance isn't the nicest but the staff and service make up for it. They are all extremely attentive and so warm and welcoming. I really feel at home here. Best of all are the prices!! So worth it, I wouldn't say it's cheap but you definitely get your money's worth and it for sure is less expensive than other vegan juice bars.,I had the curry tofu wrap with hummus and the ABC juice (Apple, Beets, Carrots). I also tried a veggie empanada which was also great. ,I also love the fact that they aren't stingy!! The portions are very filling."
"115 SW 107th Ave, Miami, FL 33174",8/31/2017,$,5,Vegan & Juice,Family owned vegan restaurant. Small and quaint but the food is delicious. Healthy option for lunch.
"115 SW 107th Ave, Miami, FL 33174",3/29/2018,$,5,Vegan & Juice,"1st time at vegan and juice and I'm very happy. I ordered take out and the staff was super attentive and very friendly. My food was delicious and inexpensive. I will definitely recommend this to my friends and I will certainly be returning, hopefully soon."
"115 SW 107th Ave, Miami, FL 33174",5/2/2018,$,4,Vegan & Juice,Great vegan place. I'm not a vegan or vegetarian but it was good change to not have meat with my food.  Try the guacamole!
"115 SW 107th Ave, Miami, FL 33174",2/24/2017,$,5,Vegan & Juice,"HONEY IS NOT VEGAN!,please consider using Agave Nectar or another subsitute! Honey is stolen from bees..,Other than that, im vegan myself and its so amazing that they have this hidden gem. Its really hard to find vegan places in Miami, this is the first ive seen that is totally vegan. i had the Avocado Tofurkey wrap and it was AMAZING. especially the pink sauce they add!!! Also had a smoothie, really natural and refreshing. Super friendly staff! Will DEFINTELY GO BACK. RECOMMEND"
"115 SW 107th Ave, Miami, FL 33174",1/22/2017,$,5,Vegan & Juice,"Vegan food is YUMMY.,The reluctant meat-lover in me finally visited Vegan & Juice after having heard great things about it. Thanks to this place, the meat-lover in me has now become open to vegan options.,This place is a family-run whole-in-the-wall....and it's absolutely wonderful. You'll be able to choose from hot foods and a variety of wraps and a few other options. Note: a lot of the hot food runs out by mid/late afternoon. On my visit, I arrived at 3pm, so most of the hot food was gone. Regardless, I tried what was left.,An awesome thing is that they let you sample the hot foods. I ordered two servings of what was left because the sample blew me away. To be honest, even though the employee repeated the name of this dish several times to me, I still don't know what it's called. Sorry fellow yelpers - but point is: it was hot, fresh, and absolutely delicious!,I also tried my boyfriend's avocado mambo wrap. I was ultra-reluctant about trying the wrap because I was ultra-doubtful that a wrap could taste good without any meat. I was wrong; it was downright delicious.,The food got me full and I felt incredibly satisfied after. Service was fantastic and prices were decent. I will absolutely undoubtedly be back."
"115 SW 107th Ave, Miami, FL 33174",8/2/2017,$,5,Vegan & Juice,"A complete twist on what you consider a savory lunch spot with a vegan twist. From Malanga Pastelon to a huge variety of freshly squeezed juices and wraps- this place proves that vegan can indeed be indulgent while not breaking the bank. It's located in a strip mall right by FIU & I suggest getting here early because once they run out if an item- they are out of it for the day. Check their Instagram for their daily menu which is released at around 11am. I shared the daily special which was a vegan pastelon, okra, and a garbanzo dish along with the avocado mambo wrap (I added tofu). I decided to get the grape juice which blew my mind! Its just pure grapes ! There's no filler! It tasted like heaven ! The Dominicans running this got it down pact and while there might be a wait to be served, your body will thank you in every way. Having vegan options allows your body to breathe from all the toxins we invest daily. I'm so happy I found this place. Oh, and the price beats all those hipster spots that serve you half the portion and charge you double the price. Try to avoid the lunch crowd and come a bit early. Please get the grape juice, you'll be glad you did!"
"115 SW 107th Ave, Miami, FL 33174",9/5/2017,$,5,Vegan & Juice,I am not a Vegan but i wanted to try something different and healthy and Man did i make a great choice. The staff was so welcoming and the food was so delicious. i would definitely come back again.
"115 SW 107th Ave, Miami, FL 33174",11/8/2016,$,5,Vegan & Juice,"Everything is so yummy that I forget that it is vegan (not that it's a bad thing). The point is, anyone can really enjoy the food here and it is very affordable. ,I guess people think that eating healthy and more organic has to be expensive. Not the case here. For under $10 I have myself a super delicious and nutritious lunch. I have been here a few times during lunch, and just wish it was a bit closer. ,The lunch special allows you to choose 4 items from their daily specials. Today I had the quinoa, beans, tofu and baked sweet potato tart. It was all very yummy and filled me up real quick. I ordered a zucchini cake to-go (for my afternoon snack). ,They are pretty busy, but the line moves quick because the foods are prepared in a buffet style where the ladies serve you from. A lot of people come in and sit by the counter bar or towards the back where they have small tables up to 4 people. Hope to be back soon!"
"115 SW 107th Ave, Miami, FL 33174",7/1/2017,$,5,Vegan & Juice,Amazing authentic Caribbean vegan food with a green juice and smoothy bar! they run out of food every day. It's that good! Had the special of the day. Asked for a second meal to go for dinner later . It's that good !
"115 SW 107th Ave, Miami, FL 33174",12/18/2017,$,5,Vegan & Juice,"What a great Yelp find in Miami! Vegan yummy food, and you don't have to be vegan to enjoy. The juices are delicious and super fresh. The wrap and salad also with super fresh veggies and lots of flavor. The strawberry vegan cake was the cherry on top :) the place is not pretty and it's in a non pretty shopping but it's great and totally worth visiting.( Also very inexpensive )"
"115 SW 107th Ave, Miami, FL 33174",6/9/2017,$,5,Vegan & Juice,"Please get non-styrofoam containers! I love the food here. It's so nice to find something healthy even though I'm not Vegan.  But it disappointing to find place especially a vegan place that uses styrofoam.,I've had the tofurkey wraps and got the $8.50 hot plate that had 4 items. The okra, zucchini boats, spinach wrap and yucca pastel were amazing. Very flavorful!,The banana cake was good, not amazing though"
